date,title,url
2002-10-02,Federal Plaza Address Opposing the War in Iraq,./Data/barackobamairaqwarspeechfederalplaza.txt
2005-01-06,Senate Speech on Ohio Electoral Vote,./Data/barackobamasenatespeechonohioelectoralvotes.txt
2005-10-25,Senate Speech Honoring the Life of Rosa Parks,./Data/barackobamasenatespeechrosaparks.txt
2005-12-15,Senate Speech on the PATRIOT Act,./Data/barackobamasenatefloorspeechpatriotact.txt
2006-01-31,Senate Speech Honoring the Life of Coretta Scott King,./Data/barackobamasenatespeechoncorettascottkingpassing.txt
2006-07-20,Senate Speech on Voting Rights Act Renewal,./Data/barackobamasenatespeechonvotingrightsactrenewal.txt
2007-03-04,Brown Chapel Speech,./Data/barackobamabrownchapel.txt
2007-03-13,Senate Speech on Iraq Federalism Amendment,./Data/barackobamasenatespeechiraqfederalismamendment.txt
2007-03-21,Senate Speech on Iraq War After 4 Years,./Data/barackobamasenatefloorspeechoniraqwar4years.txt
2007-05-23,Senate Speech on Comprehensive Immigration Reform,./Data/barackobamasenatefloorimmigration.txt
2007-11-10,Speech at the Jefferson-Jackson Dinner,./Data/barackobamajeffersonjacksondinner.txt
2008-01-03,Iowa Caucus Victory Speech,./Data/barackobamaiowavictoryspeech.txt
2008-01-08,New Hampshire Primary Concession Speech,./Data/barackobamanewhampshireconcessionspeech.txt
2008-01-20,Ebenezer Baptist Church Speech,./Data/barackobamaebenezerbaptist.txt
2008-01-26,South Carolina Primary Victory Speech,./Data/barackobamasouthcarolinavictory.txt
2008-07-15,Policy Speech on Iraq at the Woodrow Wilson Center,./Data/barackobamairaqwarreaganbuilding.txt
2008-10-01,Senate Speech on Wall Street Bailout Bill,./Data/barackobamasenatespeechonbailoutbill.txt
2008-11-07,First President-Elect Press Conference,./Data/barackobamafirstpressconference.txt
2008-11-18,Global Climate Summit Prerecorded Speech,./Data/barackobamaglobalclimatesummit.txt
2008-11-24,Economic Team Announcement Speech,./Data/barackobamaeconomicteamannouncement.txt
2008-11-25,Management and Budget Office Announcement,./Data/barackobamamanagementandbudgetoffice.txt
2008-11-26,Economic Recovery Advisory Board Announcement,./Data/barackobamaeconomicrecoveryadvisoryboard.txt
2008-12-01,Security Team Announcement Speech,./Data/barackobamasecurityteamannouncement.txt
2008-12-03,Commerce Secretary Announcement,./Data/barackobamasecretarycommerce.txt
2009-01-05,Remarks After Meeting with Economic Team,./Data/barackobamapresseconomicrecoverypressconference.txt
2009-01-08,George Mason University Speech,./Data/barackobamageorgemason.txt
2009-01-09,Intelligence Community Leadership Team,./Data/barackobamamintelligenceteam.txt
2009-01-18,Lincoln Memorial Pre-Inauguration Speech,./Data/barackobamapreinaugurallincolnmemorial.txt
2009-01-20,FIRST PRESIDENTIAL INAUGURAL ADDRESS,./Data/barackobamainauguraladdress.txt
2009-01-24,First Presidential Weekly Speech,./Data/barackobamaweekly1.txt
2009-01-26,Al-Arabiya Television Interview,./Data/barackobamaal-arabiya.txt
2009-02-04,Executive Compensation Salary Cap Speech,./Data/barackobamaexecutivecompensation.txt
2009-02-09,First Prime Time Press Conference,./Data/barackobamafirstprimetimepressconference.txt
2009-02-12,Abraham Lincoln D.C. Bicentennial Celebration Speech,./Data/barackobamalincolnbicentennialspeech.txt
2009-02-12,Lincoln Association 102nd Birthday Banquet Speech,./Data/barackobamalincolnbirthdaybanquet.txt
2009-02-24,State of the Nation Address to Congress Speech,./Data/barackobamajointsession2009.txt
2009-02-27,Ending the Iraq War at Camp Lejeune Speech,./Data/barackobamacamplejeune2009.txt
2009-03-10,Speech to Hispanic Chamber of Commerce,./Data/barackobamahispanicchamberofcommerce.txt
2009-04-02,G-20 London Economic Summit Press Conference,./Data/barackobamag20summitpressconference.txt
2009-04-03,Speech at Strasbourg Town Hall,./Data/barackobamastrasbourgspeech.txt
2009-04-05,Speech at Hradcany Square in Prague,./Data/barackobamapraguespeech.txt
2009-04-06,Speech to the Turkish Parliament,./Data/barackobamaturkishparliament.txt
2009-04-14,A New Foundation Speech at Georgetown,./Data/barackobamaeconomicvisiongeorgetown.txt
2009-04-20,First Address at the Central Intelligence Agency,./Data/barackobamaCIAfirstvisit.txt
2009-04-23,Holocaust Days of Remembrance Ceremony Speech,./Data/barackobamaholocaustdaysofremembrance.txt
2009-05-09,White House Correspondents Dinner Speech,./Data/barackobamawhitehousecorrespondentsdinner2009.txt
2009-05-14,Arizona State University Commencement Address,./Data/barackobamaarizonastateuniversitycommencement.txt
2009-05-17,Joint Press Remarks with Benjamin Netanyahu,./Data/barackobamajointpressbenjaminnetanyahu.txt
2009-05-18,Notre Dame University Commencement Speech,./Data/barackobamanotredamecommencement.txt
2009-05-21,National Security Speech at the National Archives,./Data/barackobamanationalarchives.txt
2009-05-29,Speech on Securing U.S. Cybersecurity Infrastructure,./Data/barackobamacybersecurity.txt
2009-06-04,"""New Beginning"" Speech at Cairo University",./Data/barackobamacairouniversity.txt
2009-06-04,Speech at Buchenwald Concentration Camp,./Data/barackobamabuchenwaldconcentrationcamp.txt
2009-06-05,Speech Marking the 65th Anniversary of D-Day,./Data/barackobamadday65anniversary.txt
2009-06-15,American Medical Association Speech,./Data/barackobamaamericanmedicalassociation.txt
2009-06-23,On the Dignity & Courage of the Iranian Peoples,./Data/barackobamauprisingiran.txt
2009-06-23,Third Prime Time Press Conference (Iran & Heath Care),./Data/barackobamapressconferenceiranandhealthcare.txt
2009-07-07,Moscow New Economic School Speech,./Data/barackobamaneweconomicschool.txt
2009-07-11,Ghanaian Parliament Address,./Data/barackobamaghanaparliament.txt
2009-07-13,Nomination of Regina Benjamin for Surgeon General,./Data/barackobamasurgeongeneralnomination.txt
2009-07-14,American Graduation Initiative Speech,./Data/barackobamaamericangraduationinitiative.txt
2009-08-29,Eulogy for Ted Kennedy,./Data/barackobamaeulogytedkennedy.txt
2009-09-08,Back-to-School Speech to America's Schoolchildren,./Data/barackobamabacktoschoolspeech.txt
2009-09-09,Eulogy for Walter Cronkite,./Data/barackobamawaltercronkiteeulogy.txt
2009-09-09,Joint Session of Congress Heath Care Speech,./Data/barackobamajointsessionhealthcare.txt
2009-09-11,9/11 Pentagon Memorial Speech,./Data/barackobama911pentagonmemorialspeech.txt
2009-09-23,United Nations 64th Session General Assembly Speech,./Data/barackobamaunitednations64.txt
2009-11-10,Fort Hood Memorial Service Speech,./Data/barackobamaforthoodmemorial.txt
2009-11-16,Town Hall Address in Shanghai,./Data/barackobamashanghaitownhall.txt
2009-12-01,Afghanistan Troop Surge at the U.S. Military Academy,./Data/barackobamawestpointafghanistan.txt
2009-12-06,Kennedy Center Honorees Address,./Data/barackobamakennedycenterhonorees2009.txt
2009-12-08,Brookings Institution Speech on Job Creation,./Data/barackobamabrookingsinstitute.txt
2009-12-10,Nobel Prize for Peace Speech and Lecture,./Data/barackobamanobelprizespeech.txt
2009-12-18,UN Copenhagen Climate Change Conference Speech,./Data/barackobamaunitednationsclimatechange.txt
2009-12-28,On NW Flight 253 Terrorist Threat and Iran Violence,./Data/barackobamaflight253terrorismiranviolence.txt
2009-12-29,NW Flight 253 Attempted Terrorist Attack Update,./Data/barackobamadetroitterroristincident.txt
2010-01-05,National Security Review Press Conference,./Data/barackobamasecurityreviewpressconference.txt
2010-01-07,Security Review Results and Aviation Security,./Data/barackobamaaviationsecurity.txt
2010-01-14,Speech on Financial Crisis Responsibility Fee,./Data/barackobamafinancialcrisisresponsiblityfee.txt
2010-01-17,Martin Luther King Remembrance Speech,./Data/barackobamamlkremembrancespeech.txt
2010-01-22,Lorain County Town Hall Speech and Q&A,./Data/barackobamaloraincountytownhallspeech.txt
2010-01-27,Auschwitz and Birkenau Remembrance Message,./Data/barackobamaauschwitzbirkenauliberation65.txt
2010-01-29,GOP Issues Conference Forum Dialogue,./Data/barackobamagophouseissuesconference.txt
2010-02-01,Press Conference on 2010 Budget Sent to Congress,./Data/barackobama2010budgettocongress.txt
2010-02-04,Speech at the 58th National Prayer Breakfast,./Data/barackobama2010prayerbreakfastspeech.txt
2010-02-09,Unannounced Briefing on Health Care and Jobs,./Data/barackobamajobshealthcarebriefing.txt
2010-02-19,Town Hall at Green Valley High School,./Data/barackobamahendersontownhall.txt
2010-03-03,Vote Push on Heath Care Reform Legislation,./Data/barackobamaheathcarevotenow.txt
2010-03-13,Blueprint for Reforming No Child Left Behind Act,./Data/barackobamanochildleftbehind.txt
2010-03-19,Health Care Speech at George Mason University,./Data/barackobamahealthcaregeorgemason.txt
2010-03-20,Speech to House Democratic Caucus on Health Care,./Data/barackobamahousedemocraticcongresshealthcare.txt
2010-03-21,Speech on House Passage of Health Care Reform Bill,./Data/barackobamapassinghealthcarebill.txt
2010-03-23,Speech on Signing Health Care Reform Bill into Law,./Data/barackobamahealthreformbillsigning.txt
2010-03-28,Speech to U.S. Military in Afghanistan,./Data/barackobamatroopsafghanistan.txt
2010-03-31,Speech on Energy Security at Andrews Air Force Base,./Data/barackobamaenergysecurityandrewsafb.txt
2010-04-08,START Treaty Joint Presser with Medvedev,./Data/barackobamastarttreaty.txt
2010-04-09,On Justice Stevens and West Virginia Mining Tragedy,./Data/barackobamawvminejusticestevens.txt
2010-04-15,NASA Space Exploration in the 21st Century Speech,./Data/barackobamanasaboldcourse.txt
2010-04-22,Cooper Union Speech on Wall Street Financial Reform,./Data/barackobamareformingwallstreet.txt
2010-04-25,Eulogy for Upper Big Branch Miners,./Data/barackobamaeulogycoalminers.txt
2010-04-29,Eulogy for Dorothy Height,./Data/barackobamadorothyheight.txt
2010-05-01,Commencement Speech at Michigan University,./Data/barackobamauniversityofmichigancommencement.txt
2010-05-01,White House Correspondents Dinner Speech,./Data/barackobamawhitehousecorrespondentsdinner2010.txt
2010-05-10,Speech Nominating Elena Kagan for USSC Justice,./Data/barackobamaelenakagannomination.txt
2010-05-22,U.S. Military Academy Commencement Address,./Data/barackobamawestpointcommencement.txt
2010-05-27,Press Conference on Gulf Oil Spill Disaster,./Data/barackobamagulfoilspillpresser.txt
2010-05-28,Grande Isle Briefing on Gulf Oil Spill Disaster,./Data/barackobamagrandeisleoilspillbriefing.txt
2010-06-02,Speech on the Economy at Carnegie Mellon,./Data/barackobamacarnegiemellon.txt
2010-06-07,Kalamazoo Central H.S. Commencement Speech,./Data/barackobamakalamazoocommencement.txt
2010-06-09,Speech on UN Security Council Sanctions Against Iran,./Data/barackobamairansanctions.txt
2010-06-15,Speech to Military Personnel in Pensacola,./Data/barackobamapensacolamilitary.txt
2010-06-15,Oval Office Speech on BP Oil Spill Disaster,./Data/barackobamabpoilspillovaloffice.txt
2010-06-16,Speech to the American Nurses Association,./Data/barackobamanursesassociation.txt
2010-06-21,Father's Day Speech,./Data/barackobamafathersday2010.txt
2010-06-23,On the Removal of Gen. McChrystal in Afghanistan,./Data/barackobamamccrystalremovedafghanistan.txt
2010-07-01,Comprehensive Immigration Reform Speech,./Data/barackobamacomprehensiveimmigrationreform.txt
2010-07-02,Eulogy for Robert Byrd,./Data/barackobamarobertbyrdeulogy.txt
2010-07-21,Dodd-Frank Consumer Protection Act Speech,./Data/barackobamawallstreetreformactsigning.txt
2010-07-29,Urban League Centennial Address on Education,./Data/barackobamaurbanleaguecentennial.txt
2010-08-02,Disabled Veterans Conference Speech on Iraq OPS,./Data/barackobamairaqendingcombat.txt
2010-08-13,Iftar Dinner Speech on Religious Tolerance,./Data/barackobamaiftardinner.txt
2010-09-11,9/11 Pentagon Memorial Speech,./Data/barackobama911pentagonmemorial.txt
2010-09-23,United Nations 65th Session General Assembly Speech,./Data/barackobamaunitednations65.txt
2010-11-03,Midterm Election Press Conference,./Data/barackobamamidtermpresser.txt
2010-11-06,U.S.-Indian Business Summit Address,./Data/barackobamamumbaibusinesssummit.txt
2010-11-08,Indian Parliament Joint Session Speech,./Data/barackobamaindianparliament.txt
2010-11-10,Indonesia University Speech,./Data/barackobamaindonesiauniversity.txt
2010-11-16,Medal of Honor Award to Salvatore Giunta Speech,./Data/barackobamagiuntamedalofhonor.txt
2010-12-03,Speech to Troops at Bagram Air Field,./Data/barackobamabagramairfield.txt
2010-12-10,Presser on Tax Cuts with William Jefferson Clinton,./Data/barackobamawjclintontaxcuts.txt
2011-01-12,Tucson Memorial Service Speech,./Data/barackobamatucsonmemorial.txt
2011-02-01,On the Political Transition in Egypt,./Data/barackobamaegyptpoliticaltransition.txt
2011-02-03,Speech at the 59th National Prayer Breakfast,./Data/barackobama2011prayerbreakfast.txt
2011-02-07,Speech to the US Chamber of Commerce,./Data/barackobamachamberofcommerce.txt
2011-02-10,National Wireless Initiative Address,./Data/barackobamanationalwirelessinitiative.txt
2011-02-11,Address on the Historic Revolution in Egypt,./Data/barackobamaegyptrevolution.txt
2011-02-23,Address on the Violence in Libya,./Data/barackobamalibya.txt
2011-03-18,Statement on Libya,./Data/barackobamalibyawarning.txt
2011-03-19,On Odyssey Dawn Limited Military Action in Libya,./Data/barackobamalibyaltdmilitaryaction.txt
2011-03-20,Speech to the People of Rio de Janeiro,./Data/barackobamariodejaneiro.txt
2011-03-21,Speech on Latin American to the People of Chile,./Data/barackobamachilespeech.txt
2011-03-28,Speech to the American People on Libya,./Data/barackobamalibyanationspeech.txt
2011-03-30,On American Energy Security at Georgetown Univ.,./Data/barackobamaamericanenergysecurity.txt
2011-04-13,Speech on Improving Fiscal Policy,./Data/barackobamafiscalpolicy2011.txt
2011-04-26,Announcement of 2012 Presidential Candidacy,./Data/barackobama2012prescandidacy.txt
2011-04-27,Speech on Release of Official Certification of Birth,./Data/barackobamabirthcertificatespeech.txt
2011-04-29,Remarks on the Tornado Devastation in Alabama,./Data/barackobamaalabamatornado.txt
2011-04-29,Commencement Speech at Miami Dade College,./Data/barackobamamiamidadecommencement.txt
2011-04-30,White House Correspondents Dinner Speech,./Data/barackobamawhitehousecorrespondentsdinner2011.txt
2011-05-01,Speech Announcing the Death of Osama Bin Laden,./Data/barackobamaosamabinladendeath.txt
2011-05-06,Speech to Troops at Fort Campbell,./Data/barackobamafortcampbellkytroops.txt
2011-05-16,Commencement Speech at Booker T. Washington HS,./Data/barackobamabookertwashington.txt
2011-05-19,On American Diplomacy in the Middle East,./Data/barackobamamiddleeastpolicy.txt
2011-05-20,Speech to Intelligence Community at CIA Headquarters,./Data/barackobamaciaheadquarters.txt
2011-05-20,Joint Press Conference with Benjamin Netanyahu,./Data/barackobamabenjaminnetanyahujointpress.txt
2011-05-22,American-Israel Public Affairs Policy Conference,./Data/barackobamaaipacpc2011.txt
2011-05-25,Speech to the British Parliament,./Data/barackobamabritishparliament.txt
2011-05-29,Speech at the Memorial for Joplin Tornado Victims,./Data/barackobamajoplinmemorial.txt
2011-05-30,Department of Defense Personnel Announcement,./Data/barackobamadefensepersonnel.txt
2011-06-22,National Speech on Afghanistan War Troop Reduction,./Data/barackobamaafghanistanwardrawdown.txt
2011-06-24,Speech at Carnegie Mellon's Robotics Center,./Data/barackobamacarnegiemellonrobotics.txt
2011-06-29,Presser on Congressional Action to Promote Job Growth,./Data/barackobamajobgrowthpresser.txt
2011-07-25,Speech to the Nation on the Budget and Debt Ceiling,./Data/barackobamadeficitreductionplan.txt
2011-07-31,Statement on the Debt Compromise Agreement,./Data/barackobamadebtapprovalstmt.txt
2011-08-02,Statement on the Approved Debt Compromise,./Data/barackobamadebtcompromise.txt
2011-08-30,To the American Legion Conference in Minnesota,./Data/barackobamaamericanlegion2011.txt
2011-09-08,Joint Session of Congress Speech on Economy and Jobs,./Data/barackobamajointsessionjobs.txt
2011-09-19,Speech on Economic Growth and Deficit Reduction,./Data/barackobamaeconomicplandebtreductionbill.txt
2011-09-20,Speech on High-Level UNGA Meeting on Libya,./Data/barackobamaunlibya.txt
2011-09-21,United Nations 66th Session General Assembly Speech,./Data/barackobamaunitednations66.txt
2011-10-16,Speech at the MLK Memorial Dedication,./Data/barackobamamlkmemorialdedication.txt
2011-10-20,Speech on the Death of Muammar Qaddafi,./Data/barackobamaqaddafideath.txt
2011-11-16,Speech to the Australian Parliament,./Data/barackobamaaustralianparliament.txt
2011-12-02,Speech to the Tribal Nations Conference,./Data/barackobamatribalnationsconference.txt
2011-12-06,Speech on the Economy at Osawatomie High School,./Data/barackobamaosawatomieeconomy.txt
2011-12-17,Weekly Address Honoring Military Servicemembers,./Data/barackobamaweeklyaddress17dec2011.txt
2012-01-05,Speech on Military Defense Strategic Review,./Data/barackobamamilitarystrategychanges.txt
2012-02-01,Address on Housing at Falls Church,./Data/barackobamahousingfallschurch.txt
2012-02-03,Address on Veterans Jobs Corps,./Data/barackobamaveteransjobscorps.txt
2012-02-29,Iraq War Veterans and Families Gala Toast,./Data/barackobamairaqwarveterangala.txt
2012-03-04,To the American-Israel Public Affairs Committee,./Data/barackobamaaipac2012.txt
2012-03-26,Hankuk University Address,./Data/barackobamahankukuniversity.txt
2012-03-29,Speech on Repealing Oil and Gas Subsidies,./Data/barackobamagasoilsubsidies.txt
2012-04-03,Speech at an Associated Press Luncheon,./Data/barackobamaapluncheon.txt
2012-04-23,U.S. Holocaust Memorial Museum Address,./Data/barackobamanationalholocaustmemorialmuseum.txt
2012-04-28,White House Correspondents Dinner Speech,./Data/barackobamawhitehousecorrespondentsdinner2012.txt
2012-05-14,Barnard College Commencement Speech,./Data/barackobamabarnardcollegecommencement.txt
2012-06-13,Shimon Peres Presidential Medal of Freedom Award,./Data/barackobamashimonperesemedaloffreedom.txt
2012-06-28,On the US Supreme Court Affordable Care Act Ruling,./Data/barackobamausschealthcareruling.txt
2012-07-20,Remarks on the Tragedy in Aurora Colorado,./Data/barackobamaauroratragedy.txt
2012-07-23,Speech to the 113th VFW Convention,./Data/barackobama113vfw.txt
2012-09-12,Rose Garden Address on Benghazi Attacks,./Data/barackobamabenghaziattacks.txt
2012-09-14,Benghazi Victims Transfer of Remains Speech,./Data/barackobamabenghazivictims.txt
2012-09-25,Clinton Global Initiative Speech on Human Trafficking,./Data/barackobamaclintonglobalinitiative2012.txt
2012-09-25,United Nations 67th Session General Assembly Speech,./Data/barackobamaunitednations67.txt
2012-10-29,On Hurricane Sandy After Emergency Team Briefings,./Data/barackobamahurricanesandy29oct.txt
2012-10-30,On Hurricane Sandy at the American Red Cross,./Data/barackobamaredcross.txt
2012-11-06,Second Presidential Election Victory Speech,./Data/barackobamasecondpresidentialvictoryspeech.txt
2012-11-09,Post Election Speech on Deficit Reduction and Jobs,./Data/barackobamapostelectioneconomy.txt
2012-11-14,First Presser Following Presidential Reelection,./Data/barackobamapresserpetraeus.txt
2012-11-19,Yangon University Address,./Data/barackobamayangonuniversity.txt
2012-12-14,On the Sandy Hook Elementary School Shootings,./Data/barackobamanewtownshooting.txt
2012-12-16,"Newtown, Connecticut Interfaith Vigil Speech",./Data/barackobamanewtownvigilspeech.txt
2012-12-19,End Year Press Conference,./Data/barackobamagunviolencepresser.txt
2012-12-21,Eulogy for Senator Daniel Inouye,./Data/barackobamadanielinouyeeulogy.txt
2013-01-14,Final First Term Press Conference,./Data/barackobamafinalfirsttermpresser.txt
2013-01-16,On Signing Executive Actions to Reduce Gun Violence,./Data/barackobamagunviolenceexecacts.txt
2013-01-21,SECOND PRESIDENTIAL INAUGURAL ADDRESS,./Data/barackobamasecondinauguraladdress.txt
2013-01-21,Inaugural Luncheon Toast,./Data/barackobamainauguralluncheontoast.txt
2013-01-29,Comprehensive Immigration Reform Speech,./Data/barackobamaimmagrationreform.txt
2013-02-12,Fourth Presidential State of the Union Speech,./Data/barackobamamiddleclasseconomy.txt
2013-02-15,On Strengthening the Economy for the Middle Class,./Data/barackobamasequesternewportnews.txt
2013-02-26,Newport News Speech on the Impact of the Sequester,./Data/barackobamarosaparksstatue.txt
2013-02-27,Rosa Parks Statue Dedication Speech,./Data/barackobamajerusalemconventioncenter.txt
2013-03-22,Speech in the Children's Memorial at Yad Vashem,./Data/barackobamachildrensmemorialyadvashem.txt
2013-04-02,BRAIN Initiative Announcement,./Data/barackobamabraininitiative.txt
2013-04-03,Gun Violence Reduction Speech in Colorado,./Data/barackobamagunviolencereductiondenver.txt
2013-04-08,Gun Violence Reduction Speech in Connecticut,./Data/barackobamagunviolencereductionconnecticut.txt
2013-04-11,U.S. Army Chaplain Emil Kapaun Medal of Honor Award,./Data/barackobamaemilkapaunmedalofhonor.txt
2013-04-15,First Statement on Boston Marathon Bombings,./Data/barackobamabostonmarathonexplosionsfirststatement.txt
2013-04-16,Second Statement on Boston Marathon Bombings,./Data/barackobamabostonmarathonexplosionssecondstatement.txt
2013-04-17,On Senate Vote Against Background Checks,./Data/barackobamasenateguncontrolbillvote.txt
2013-04-18,Boston Interfaith Prayer Service Speech,./Data/barackobamabostoninterfaithprayerservice.txt
2013-04-19,Third Statement on Boston Marathon Bombings,./Data/barackobamabostonmarathonexplosionsthirdstatement.txt
2013-04-25,George W. Bush Presidential Library Dedication Speech,./Data/barackobamagwbushlibrarydedication.txt
2013-04-25,West Fertilizer Plant Tragedy Memorial Speech,./Data/barackobamawestfertilizerplantmemorial.txt
2013-04-27,White House Correspondents Dinner Speech,./Data/barackobamawhitehousecorrespondentsdinner2013.txt
2013-04-30,Press Q&A on Syria and Sundry Topics,./Data/barackobamasyriaetalpresser.txt
2013-05-03,Speech to the People of Mexico,./Data/barackobamamexicopeople.txt
2013-05-15,Remarks on IG Audit of the IRS,./Data/barackobamairsmisconduct.txt
2013-05-19,Morehouse College Commencement Address,./Data/barackobamamorehousecollegecommencement.txt
2013-05-23,National Defense University Speech on Terrorism,./Data/barackobamanationaldefenseuniversity.txt
2013-05-24,U.S. Naval Academy Commencement Address,./Data/barackobamanavalacademycommencement.txt
2013-06-07,On Affordable Care Act and Domestic Surveillance,./Data/barackobamasanjosesurveillance.txt
2013-06-11,US Senate Call to Comprehensive Immigration Reform,./Data/barackobamaimmigrationreformcomprehensive.txt
2013-06-17,Northern Ireland Speech,./Data/barackobamanorthernireland.txt
2013-06-19,Brandenburg Gate Speech,./Data/barackobamabrandenburggate.txt
2013-06-30,Cape Town University Speech,./Data/barackobamacapetownuniversity.txt
2013-07-19,Speech on Trayvon Martin,./Data/barackobamatrayvonmartin.txt
2013-07-24,Knox College Speech on the Economy,./Data/barackobamaknoxcollegeeconomy.txt
2013-07-27,Korean War Armistice Signing 60th Anniversary Speech,./Data/barackobamakoreanwar60tharmistice.txt
2013-08-09,Intelligence Gathering Reform Press Conference,./Data/barackobamaintelreformpresser.txt
2013-08-28,'Let Freedom Ring' Ceremony Speech,./Data/barackobamaletfreedomringceremony.txt
2013-08-31,On Syrian Government Use of Chemical Weapons,./Data/barackobamasyriachemicalweapons.txt
2013-09-10,Speech to the Nation on Syria,./Data/barackobamasyrianation.txt
2013-09-22,Navy Yard Shooting Memorial Speech,./Data/barackobamanavyyardshootingmemorial.txt
2013-09-24,United Nations 68th Session General Assembly Speech,./Data/barackobamaunitednations68.txt
2013-09-24,On Health Care at WJClinton Global Initiative,./Data/barackobamaclintonglobalinitiative.txt
2013-10-02,Government Shutdown Statement,./Data/barackobamagovernmentshutdown.txt
2013-10-21,Affordable Care Act Website Issues Address,./Data/barackobamaaffordablecareactwebsiteproblems.txt
2013-11-11,Veterans Day Address,./Data/barackobamaveteransday2013.txt
2013-11-14,Affordable Care Act Changes Press Conference,./Data/barackobamaaffordablecareactchanges.txt
2013-11-23,Iran Accord Statement,./Data/barackobamairanaccordstatement.txt
2013-12-05,"On the Passing of Nelson ""Madiba"" Mandela",./Data/barackobamamandelapassing.txt
2013-12-10,Address at the Public Memorial for Nelson Mandela,./Data/barackobamanelsonmandelamemorial.txt
2013-12-20,End of Year Press Conference,./Data/barackobamafinal2013presser.txt
2014-01-17,On Proposed Changes to US Intelligence Programs,./Data/barackobamasignalsintelreview.txt
2014-02-06,Speech at the 62nd National Prayer Breakfast,./Data/barackobama2014prayerbreakfast.txt
2014-03-26,Speech to European Youth in Belgium,./Data/barackobamaeuropeanyouth.txt
2014-04-10,Civil Rights Summit Keynote Speech,./Data/barackobamaaustincivilrights.txt
2014-04-17,Press Conference on Affordable Care Act and Ukraine,./Data/barackobamapressconference04-17-14.txt
2014-04-24,Joint Presser with Japan Prime Minister Shinzo Abe,./Data/barackobamapmabejapanjointpresser.txt
2014-04-27,Young Leaders Town Hall Malaysia,./Data/barackobamaYSEALIMalaysia.txt
2014-04-28,Joint Presser with Philippine President Aquino,./Data/barackobamabenignoaquinojointpresser.txt
2014-04-29,Fort Bonifacio Address,./Data/barackobamafortbonifacio.txt
2014-05-03,White House Correspondents Dinner Speech,./Data/barackobamawhitehousecorrespondentsdinner2014.txt
2014-05-21,On Misconduct Allegations at the VA,./Data/barackobamavamisconductallegations.txt
2014-05-27,Statement on Afghanistan,./Data/barackobamastatementonafghanistan.txt
2014-05-28,U.S. Military Academy Commencement Address,./Data/barackobamawestpointcommencement2014.txt
2014-05-30,Presser on VA Department Misconduct,./Data/barackobamaveteransaffairsmisconduct.txt
2014-06-04,Polish Freedom Day Anniversary Address,./Data/barackobamafreedomdaypoland.txt
