date,source,sentence,depth
2008-06-03,gwb,"To Chairman Dean and my great friend Dick Durbin; and to all my fellow citizens of this great nation; With profound gratitude and great humility, I accept your nomination for the presidency of the United States.",6
2008-06-03,gwb,"Let me express my thanks to the historic slate of candidates who accompanied me on this journey, and especially the one who traveled the farthest – a champion for working Americans and an inspiration to my daughters and to yours -- Hillary Rodham Clinton.",9
2008-06-03,gwb,"To President Clinton, who last night made the case for change as only he can make it; to Ted Kennedy, who embodies the spirit of service; and to the next Vice President of the United States, Joe Biden, I thank you.",6
2008-06-03,gwb,"I am grateful to finish this journey with one of the finest statesmen of our time, a man at ease with everyone from world leaders to the conductors on the Amtrak train he still takes home every night.",9
2008-06-03,gwb,"To the love of my life, our next First Lady, Michelle Obama, and to Sasha and Malia – I love you so much, and I'm so proud of all of you.",6
2008-06-03,gwb,"Four years ago, I stood before you and told you my story – of the brief union between a young man from Kenya and a young woman from Kansas who weren't well-off or well-known, but shared a belief that in America, their son could achieve whatever he put his mind to.",11
2008-06-03,gwb,"It is that promise that has always set this country apart – that through hard work and sacrifice, each of us can pursue our individual dreams but still come together as one American family, to ensure that the next generation can pursue their dreams as well.",7
2008-06-03,gwb,That's why I stand here tonight.,2
2008-06-03,gwb,"Because for two hundred and thirty two years, at each moment when that promise was in jeopardy, ordinary men and women – students and soldiers, farmers and teachers, nurses and janitors -- found the courage to keep it alive.",6
2008-06-03,gwb,"We meet at one of those defining moments – a moment when our nation is at war, our economy is in turmoil, and the American promise has been threatened once more.",7
2008-06-03,gwb,"Tonight, more Americans are out of work and more are working harder for less.",3
2008-06-03,gwb,More of you have lost your homes and even more are watching your home values plummet.,4
2008-06-03,gwb,"More of you have cars you can't afford to drive, credit card bills you can't afford to pay, and tuition that's beyond your reach.",4
2008-06-03,gwb,These challenges are not all of government's making.,5
2008-06-03,gwb,But the failure to respond is a direct result of a broken politics in Washington and the failed policies of George W. Bush.,7
2008-06-03,gwb,"America, we are better than these last eight years.",4
2008-06-03,gwb,We are a better country than this.,3
2008-06-03,gwb,"This country is more decent than one where a woman in Ohio, on the brink of retirement, finds herself one illness away from disaster after a lifetime of hard work.",9
2008-06-03,gwb,"This country is more generous than one where a man in Indiana has to pack up the equipment he's worked on for twenty years and watch it shipped off to China, and then chokes up as he explains how he felt like a failure when he went home to tell his family the news.",10
2008-06-03,gwb,We are more compassionate than a government that lets veterans sleep on our streets and families slide into poverty; that sits on its hands while a major American city drowns before our eyes.,9
2008-06-03,gwb,"Tonight, I say to the American people, to Democrats and Republicans and Independents across this great land – enough!",4
2008-06-03,gwb,"This moment – this election – is our chance to keep, in the 21st century, the American promise alive.",5
2008-06-03,gwb,"Because next week, in Minnesota, the same party that brought you two terms of George Bush and Dick Cheney will ask this country for a third.",7
2008-06-03,gwb,And we are here because we love this country too much to let the next four years look like the last eight.,4
2008-06-03,gwb,"On November 4th, we must stand up and say: ""Eight is enough.""",3
2008-06-03,gwb,Now let there be no doubt.,3
2008-06-03,gwb,"The Republican nominee, John McCain, has worn the uniform of our country with bravery and distinction, and for that we owe him our gratitude and respect.",4
2008-06-03,gwb,"And next week, we'll also hear about those occasions when he's broken with his party as evidence that he can deliver the change that we need.",7
2008-06-03,gwb,But the record's clear: John McCain has voted with George Bush ninety percent of the time.,4
2008-06-03,gwb,"Senator McCain likes to talk about judgment, but really, what does it say about your judgment when you think George Bush has been right more than ninety percent of the time?",7
2008-06-03,gwb,"I don't know about you, but I'm not ready to take a ten percent chance on change.",6
2008-06-03,gwb,"The truth is, on issue after issue that would make a difference in your lives – on health care and education and the economy – Senator McCain has been anything but independent.",10
2008-06-03,gwb,"He said that our economy has made ""great progress"" under this President.",4
2008-06-03,gwb,He said that the fundamentals of the economy are strong.,5
2008-06-03,gwb,"And when one of his chief advisors – the man who wrote his economic plan – was talking about the anxiety Americans are feeling, he said that we were just suffering from a ""mental recession,"" and that we've become, and I quote, ""a nation of whiners.""",8
2008-06-03,gwb,A nation of whiners?,2
2008-06-03,gwb,"Tell that to the proud auto workers at a Michigan plant who, after they found out it was closing, kept showing up every day and working as hard as ever, because they knew there were people who counted on the brakes that they made.",9
2008-06-03,gwb,Tell that to the military families who shoulder their burdens silently as they watch their loved ones leave for their third or fourth or fifth tour of duty.,6
2008-06-03,gwb,These are not whiners.,1
2008-06-03,gwb,They work hard and give back and keep going without complaint.,5
2008-06-03,gwb,These are the Americans that I know.,3
2008-06-03,gwb,"Now, I don't believe that Senator McCain doesn't care what's going on in the lives of Americans.",6
2008-06-03,gwb,I just think he doesn't know.,2
2008-06-03,gwb,Why else would he define middle-class as someone making under five million dollars a year?,6
2008-06-03,gwb,How else could he propose hundreds of billions in tax breaks for big corporations and oil companies but not one penny of tax relief to more than one hundred million Americans?,7
2008-06-03,gwb,"How else could he offer a health care plan that would actually tax people's benefits, or an education plan that would do nothing to help families pay for college, or a plan that would privatize Social Security and gamble your retirement?",7
2008-06-03,gwb,It's not because John McCain doesn't care.,3
2008-06-03,gwb,It's because John McCain doesn't get it.,3
2008-06-03,gwb,"For over two decades, he's subscribed to that old, discredited Republican philosophy – give more and more to those with the most and hope that prosperity trickles down to everyone else.",7
2008-06-03,gwb,"In Washington, they call this the Ownership Society, but what it really means is – you're on your own.",5
2008-06-03,gwb,Out of work?,2
2008-06-03,gwb,Tough luck.,1
2008-06-03,gwb,No health care?,1
2008-06-03,gwb,The market will fix it.,2
2008-06-03,gwb,Born into poverty?,2
2008-06-03,gwb,Pull yourself up by your own bootstraps – even if you don't have boots.,3
2008-06-03,gwb,You're on your own.,3
2008-06-03,gwb,Well it's time for them to own their failure.,4
2008-06-03,gwb,It's time for us to change America.,3
2008-06-03,gwb,"You see, we Democrats have a very different measure of what constitutes progress in this country.",7
2008-06-03,gwb,We measure progress by how many people can find a job that pays the mortgage; whether you can put a little extra money away at the end of each month so you can someday watch your child receive her college diploma.,7
2008-06-03,gwb,"We measure progress in the 23 million new jobs that were created when Bill Clinton was President – when the average American family saw its income go up $7,500 instead of down $2,000 like it has under George Bush.",12
2008-06-03,gwb,"We measure the strength of our economy not by the number of billionaires we have or the profits of the Fortune 500, but by whether someone with a good idea can take a risk and start a new business, or whether the waitress who lives on tips can take a day off to look after a sick kid without losing her job – an economy that honors the dignity of work.",17
2008-06-03,gwb,The fundamentals we use to measure economic strength are whether we are living up to that fundamental promise that has made this country great – a promise that is the only reason I am standing here tonight.,9
2008-06-03,gwb,"Because in the faces of those young veterans who come back from Iraq and Afghanistan, I see my grandfather, who signed up after Pearl Harbor, marched in Patton's Army, and was rewarded by a grateful nation with the chance to go to college on the GI Bill.",9
2008-06-03,gwb,"In the face of that young student who sleeps just three hours before working the night shift, I think about my mom, who raised my sister and me on her own while she worked and earned her degree; who once turned to food stamps but was still able to send us to the best schools in the country with the help of student loans and scholarships.",9
2008-06-03,gwb,"When I listen to another worker tell me that his factory has shut down, I remember all those men and women on the South Side of Chicago who I stood by and fought for two decades ago after the local steel plant closed.",7
2008-06-03,gwb,"And when I hear a woman talk about the difficulties of starting her own business, I think about my grandmother, who worked her way up from the secretarial pool to middle-management, despite years of being passed over for promotions because she was a woman.",8
2008-06-03,gwb,She's the one who taught me about hard work.,5
2008-06-03,gwb,She's the one who put off buying a new car or a new dress for herself so that I could have a better life.,7
2008-06-03,gwb,She poured everything she had into me.,4
2008-06-03,gwb,"And although she can no longer travel, I know that she's watching tonight, and that tonight is her night as well.",5
2008-06-03,gwb,"I don't know what kind of lives John McCain thinks that celebrities lead, but this has been mine.",4
2008-06-03,gwb,These are my heroes.,2
2008-06-03,gwb,Theirs are the stories that shaped me.,3
2008-06-03,gwb,And it is on their behalf that I intend to win this election and keep our promise alive as President of the United States.,9
2008-06-03,gwb,What is that promise?,2
2008-06-03,gwb,"It's a promise that says each of us has the freedom to make of our own lives what we will, but that we also have the obligation to treat each other with dignity and respect.",9
2008-06-03,gwb,"It's a promise that says the market should reward drive and innovation and generate growth, but that businesses should live up to their responsibilities to create American jobs, look out for American workers, and play by the rules of the road.",8
2008-06-03,gwb,"Ours is a promise that says government cannot solve all our problems, but what it should do is that which we cannot do for ourselves – protect us from harm and provide every child a decent education; keep our water clean and our toys safe; invest in new schools and new roads and new science and technology.",7
2008-06-03,gwb,"Our government should work for us, not against us.",2
2008-06-03,gwb,"It should help us, not hurt us.",2
2008-06-03,gwb,"It should ensure opportunity not just for those with the most money and influence, but for every American who's willing to work.",7
2008-06-03,gwb,"That's the promise of America – the idea that we are responsible for ourselves, but that we also rise or fall as one nation; the fundamental belief that I am my brother's keeper; I am my sister's keeper.",8
2008-06-03,gwb,That's the promise we need to keep.,4
2008-06-03,gwb,That's the change we need right now.,4
2008-06-03,gwb,So let me spell out exactly what that change would mean if I am President.,4
2008-06-03,gwb,"Change means a tax code that doesn't reward the lobbyists who wrote it, but the American workers and small businesses who deserve it.",5
2008-06-03,gwb,"Unlike John McCain, I will stop giving tax breaks to corporations that ship jobs overseas, and I will start giving them to companies that create good jobs right here in America.",8
2008-06-03,gwb,"I will eliminate capital gains taxes for the small businesses and the start-ups that will create the high-wage, high-tech jobs of tomorrow.",7
2008-06-03,gwb,I will cut taxes – cut taxes – for 95% of all working families.,5
2008-06-03,gwb,"Because in an economy like this, the last thing we should do is raise taxes on the middle-class.",4
2008-06-03,gwb,"And for the sake of our economy, our security, and the future of our planet, I will set a clear goal as President: in ten years, we will finally end our dependence on oil from the Middle East.",10
2008-06-03,gwb,"Washington's been talking about our oil addiction for the last thirty years, and John McCain has been there for twenty-six of them.",5
2008-06-03,gwb,"In that time, he's said no to higher fuel-efficiency standards for cars, no to investments in renewable energy, no to renewable fuels.",5
2008-06-03,gwb,"And today, we import triple the amount of oil as the day that Senator McCain took office.",5
2008-06-03,gwb,"Now is the time to end this addiction, and to understand that drilling is a stop-gap measure, not a long-term solution.",6
2008-06-03,gwb,Not even close.,1
2008-06-03,gwb,"As President, I will tap our natural gas reserves, invest in clean coal technology, and find ways to safely harness nuclear power.",6
2008-06-03,gwb,"I'll help our auto companies re-tool, so that the fuel-efficient cars of the future are built right here in America.",5
2008-06-03,gwb,I'll make it easier for the American people to afford these new cars.,4
2008-06-03,gwb,"And I'll invest 150 billion dollars over the next decade in affordable, renewable sources of energy – wind power and solar power and the next generation of biofuels; an investment that will lead to new industries and five million new jobs that pay well and can't ever be outsourced.",7
2008-06-03,gwb,"America, now is not the time for small plans.",4
2008-06-03,gwb,"Now is the time to finally meet our moral obligation to provide every child a world-class education, because it will take nothing less to compete in the global economy.",7
2008-06-03,gwb,Michelle and I are only here tonight because we were given a chance at an education.,4
2008-06-03,gwb,And I will not settle for an America where some kids don't have that chance.,5
2008-06-03,gwb,I'll invest in early childhood education.,3
2008-06-03,gwb,"I'll recruit an army of new teachers, and pay them higher salaries and give them more support.",4
2008-06-03,gwb,"And in exchange, I'll ask for higher standards and more accountability.",4
2008-06-03,gwb,"And we will keep our promise to every young American – if you commit to serving your community or your country, we will make sure you can afford a college education.",7
2008-06-03,gwb,"Now is the time to finally keep the promise of affordable, accessible health care for every single American.",8
2008-06-03,gwb,"If you have health care, my plan will lower your premiums.",3
2008-06-03,gwb,"If you don't, you'll be able to get the same kind of coverage that members of Congress give themselves.",7
2008-06-03,gwb,"And as someone who watched my mother argue with insurance companies while she lay in bed dying of cancer, I will make certain those companies stop discriminating against those who are sick and need care the most.",7
2008-06-03,gwb,"Now is the time to help families with paid sick days and better family leave, because nobody in America should have to choose between keeping their jobs and caring for a sick child or ailing parent.",9
2008-06-03,gwb,"Now is the time to change our bankruptcy laws, so that your pensions are protected ahead of CEO bonuses; and the time to protect Social Security for future generations.",6
2008-06-03,gwb,"And now is the time to keep the promise of equal pay for an equal day's work, because I want my daughters to have exactly the same opportunities as your sons.",6
2008-06-03,gwb,"Now, many of these plans will cost money, which is why I've laid out how I'll pay for every dime – by closing corporate loopholes and tax havens that don't help America grow.",9
2008-06-03,gwb,"But I will also go through the federal budget, line by line, eliminating programs that no longer work and making the ones we do need work better and cost less – because we cannot meet twenty-first century challenges with a twentieth century bureaucracy.",7
2008-06-03,gwb,"And Democrats, we must also admit that fulfilling America's promise will require more than just money.",5
2008-06-03,gwb,"It will require a renewed sense of responsibility from each of us to recover what John F. Kennedy called our ""intellectual and moral strength.""",7
2008-06-03,gwb,"Yes, government must lead on energy independence, but each of us must do our part to make our homes and businesses more efficient.",5
2008-06-03,gwb,"Yes, we must provide more ladders to success for young men who fall into lives of crime and despair.",10
2008-06-03,gwb,But we must also admit that programs alone can't replace parents; that government can't turn off the television and make a child do her homework; that fathers must take more responsibility for providing the love and guidance their children need.,7
2008-06-03,gwb,Individual responsibility and mutual responsibility – that's the essence of America's promise.,5
2008-06-03,gwb,"And just as we keep our keep our promise to the next generation here at home, so must we keep America's promise abroad.",7
2008-06-03,gwb,"If John McCain wants to have a debate about who has the temperament, and judgment, to serve as the next Commander-in-Chief, that's a debate I'm ready to have.",7
2008-06-03,gwb,"For while Senator McCain was turning his sights to Iraq just days after 9/11, I stood up and opposed this war, knowing that it would distract us from the real threats we face.",7
2008-06-03,gwb,"When John McCain said we could just ""muddle through"" in Afghanistan, I argued for more resources and more troops to finish the fight against the terrorists who actually attacked us on 9/11, and made clear that we must take out Osama bin Laden and his lieutenants if we have them in our sights.",7
2008-06-03,gwb,John McCain likes to say that he'll follow bin Laden to the Gates of Hell – but he won't even go to the cave where he lives.,6
2008-06-03,gwb,"And today, as my call for a time frame to remove our troops from Iraq has been echoed by the Iraqi government and even the Bush Administration, even after we learned that Iraq has a $79 billion surplus while we're wallowing in deficits, John McCain stands alone in his stubborn refusal to end a misguided war.",6
2008-06-03,gwb,That's not the judgment we need.,3
2008-06-03,gwb,That won't keep America safe.,1
2008-06-03,gwb,"We need a President who can face the threats of the future, not keep grasping at the ideas of the past.",7
2008-06-03,gwb,You don't defeat a terrorist network that operates in eighty countries by occupying Iraq.,5
2008-06-03,gwb,You don't protect Israel and deter Iran just by talking tough in Washington.,5
2008-06-03,gwb,You can't truly stand up for Georgia when you've strained our oldest alliances.,3
2008-06-03,gwb,"If John McCain wants to follow George Bush with more tough talk and bad strategy, that is his choice – but it is not the change we need.",6
2008-06-03,gwb,We are the party of Roosevelt.,3
2008-06-03,gwb,We are the party of Kennedy.,3
2008-06-03,gwb,So don't tell me that Democrats won't defend this country.,3
2008-06-03,gwb,Don't tell me that Democrats won't keep us safe.,2
2008-06-03,gwb,"The Bush-McCain foreign policy has squandered the legacy that generations of Americans -- Democrats and Republicans – have built, and we are here to restore that legacy.",7
2008-06-03,gwb,"As Commander-in-Chief, I will never hesitate to defend this nation, but I will only send our troops into harm's way with a clear mission and a sacred commitment to give them the equipment they need in battle and the care and benefits they deserve when they come home.",12
2008-06-03,gwb,"I will end this war in Iraq responsibly, and finish the fight against al Qaeda and the Taliban in Afghanistan.",7
2008-06-03,gwb,I will rebuild our military to meet future conflicts.,3
2008-06-03,gwb,"But I will also renew the tough, direct diplomacy that can prevent Iran from obtaining nuclear weapons and curb Russian aggression.",7
2008-06-03,gwb,I will build new partnerships to defeat the threats of the 21st century: terrorism and nuclear proliferation; poverty and genocide; climate change and disease.,7
2008-06-03,gwb,"And I will restore our moral standing, so that America is once again that last, best hope for all who are called to the cause of freedom, who long for lives of peace, and who yearn for a better future.",14
2008-06-03,gwb,These are the policies I will pursue.,3
2008-06-03,gwb,"And in the weeks ahead, I look forward to debating them with John McCain.",5
2008-06-03,gwb,But what I will not do is suggest that the Senator takes his positions for political purposes.,6
2008-06-03,gwb,Because one of the things that we have to change in our politics is the idea that people cannot disagree without challenging each other's character and patriotism.,8
2008-06-03,gwb,"The times are too serious, the stakes are too high for this same partisan playbook.",4
2008-06-03,gwb,So let us agree that patriotism has no party.,4
2008-06-03,gwb,"I love this country, and so do you, and so does John McCain.",4
2008-06-03,gwb,"The men and women who serve in our battlefields may be Democrats and Republicans and Independents, but they have fought together and bled together and some died together under the same proud flag.",5
2008-06-03,gwb,They have not served a Red America or a Blue America – they have served the United States of America.,4
2008-06-03,gwb,"So I've got news for you, John McCain.",4
2008-06-03,gwb,We all put our country first.,2
2008-06-03,gwb,"America, our work will not be easy.",2
2008-06-03,gwb,"The challenges we face require tough choices, and Democrats as well as Republicans will need to cast off the worn-out ideas and politics of the past.",6
2008-06-03,gwb,For part of what has been lost these past eight years can't just be measured by lost wages or bigger trade deficits.,6
2008-06-03,gwb,What has also been lost is our sense of common purpose – our sense of higher purpose.,5
2008-06-03,gwb,And that's what we have to restore.,3
2008-06-03,gwb,"We may not agree on abortion, but surely we can agree on reducing the number of unwanted pregnancies in this country.",9
2008-06-03,gwb,"The reality of gun ownership may be different for hunters in rural Ohio than for those plagued by gang-violence in Cleveland, but don't tell me we can't uphold the Second Amendment while keeping AK-47s out of the hands of criminals.",8
2008-06-03,gwb,"I know there are differences on same-sex marriage, but surely we can agree that our gay and lesbian brothers and sisters deserve to visit the person they love in the hospital and to live lives free of discrimination.",8
2008-06-03,gwb,"Passions fly on immigration, but I don't know anyone who benefits when a mother is separated from her infant child or an employer undercuts American wages by hiring illegal workers.",8
2008-06-03,gwb,This too is part of America's promise – the promise of a democracy where we can find the strength and grace to bridge divides and unite in common effort.,12
2008-06-03,gwb,I know there are those who dismiss such beliefs as happy talk.,6
2008-06-03,gwb,"They claim that our insistence on something larger, something firmer and more honest in our public life is just a Trojan Horse for higher taxes and the abandonment of traditional values.",6
2008-06-03,gwb,And that's to be expected.,2
2008-06-03,gwb,"Because if you don't have any fresh ideas, then you use stale tactics to scare the voters.",3
2008-06-03,gwb,"If you don't have a record to run on, then you paint your opponent as someone people should run from.",4
2008-06-03,gwb,You make a big election about small things.,4
2008-06-03,gwb,And you know what – it's worked before.,2
2008-06-03,gwb,Because it feeds into the cynicism we all have about government.,5
2008-06-03,gwb,"When Washington doesn't work, all its promises seem empty.",2
2008-06-03,gwb,"If your hopes have been dashed again and again, then it's best to stop hoping, and settle for what you already know.",4
2008-06-03,gwb,I get it.,1
2008-06-03,gwb,I realize that I am not the likeliest candidate for this office.,5
2008-06-03,gwb,"I don't fit the typical pedigree, and I haven't spent my career in the halls of Washington.",5
2008-06-03,gwb,But I stand before you tonight because all across America something is stirring.,3
2008-06-03,gwb,What the nay-sayers don't understand is that this election has never been about me.,3
2008-06-03,gwb,It's been about you.,2
2008-06-03,gwb,"For eighteen long months, you have stood up, one by one, and said enough to the politics of the past.",6
2008-06-03,gwb,"You understand that in this election, the greatest risk we can take is to try the same old politics with the same old players and expect a different result.",5
