date,source,sentence,depth
2007-12-19,gwb,"Because this dependence harms us economically through high and volatile prices at the gas pump, dependence creates pollution and contributes to greenhouse gas admissions.",6
2007-12-19,gwb,It threatens our national security by making us vulnerable to hostile regimes in unstable regions of the world.,8
2007-12-19,gwb,It makes us vulnerable to terrorists who might attack oil infrastructure.,6
2007-12-19,gwb,The legislation I am signing today will address our vulnerabilities and our dependence in two important ways.,5
2007-12-19,gwb,"First, it will increase the supply of alternative fuel sources.",4
2007-12-19,gwb,I proposed an alternative fuel standard earlier this year.,2
2007-12-19,gwb,This standard would require fuel producers to include a certain amount of alternative fuels in their products.,5
2007-12-19,gwb,This standard would create new markets for foreign products used to produce these fuels.,5
2007-12-19,gwb,"This standard would increase our energy security by making us less vulnerable to instability, to the instability of oil prices on the world market.",7
2007-12-19,gwb,The bill I sign today takes a significant step because it will require fuel producers to use at least 36 billion gallons of biofuel in 2022.,6
2007-12-19,gwb,This is nearly a fivefold increase over current levels.,4
2007-12-19,gwb,It will help us diversify our energy supplies and reduce our dependence on oil.,5
2007-12-19,gwb,"It's an important part of this legislation, and I thank the Members of Congress for your wisdom.",4
2007-12-19,gwb,"Second, the legislation also—will also reduce our demand for oil by increasing fuel economy standards.",4
2007-12-19,gwb,"Last January, I called for the first statutory increase in fuel economy standards for automobiles since they were enacted in 1975.",6
2007-12-19,gwb,The bill I'm about to sign delivers on that request.,7
2007-12-19,gwb,"It specifies a national standard of 35 miles per gallon by 2020, which will increase fuel economy standards by 40 percent and save billions of gallons of fuel.",9
2007-12-19,gwb,This bill also includes an important reform that I believe is essential to making sure that we realize this strategy.,10
2007-12-19,gwb,"It allows the Department of Transportation to issue what are known as attribute-based standards, which will assure that increased fuel efficiency does not come at the expense of automobile safety.",11
2007-12-19,gwb,"This is an important part of this bill, and again, I thank the Members for taking the lead.",5
2007-12-19,gwb,The bill also includes revisions to improve energy efficiency in lighting and appliances.,5
2007-12-19,gwb,It adopts elements of the Executive order I signed requiring Federal Agencies to lead by example in efficiency and renewable energy use.,12
2007-12-19,gwb,"Taken together, all these measures will help us improve our environment.",3
2007-12-19,gwb,It is estimated that these initiatives could reduce projected CO2 emissions by billions of metric tons.,6
2007-12-19,gwb,"The U.N. climate change meeting in Bali last week, our Nation promised to pursue new, quantifiable actions to reduce carbon emissions.",5
2007-12-19,gwb,Today we're doing just that.,2
2007-12-19,gwb,The legislation I'm signing today will lead to some of the largest CO2 emission cuts in our Nation's history.,8
2007-12-19,gwb,The legislation I'm about to sign should say to the American people that we can find common ground on critical issues.,5
2007-12-19,gwb,And there's more we can accomplish together.,2
2007-12-19,gwb,New technologies will bring about a new era of energy.,3
2007-12-19,gwb,So I appreciate the fact that Congress—in the omnibus spending bill that I'm going to sign later on—recognizes that new technologies will help usher in a better quality of life for our citizens.,7
2007-12-19,gwb,And so we're going to spend money on new research for alternative feedstocks for ethanol.,7
2007-12-19,gwb,"I mean, we understand the hog growers are getting nervous because the price of corn is up.",5
2007-12-19,gwb,But we also believe strongly that research will enable us to use wood chips and switchgrass and biomass to be able to develop the ethanol necessary to help us realize the vision outlined in this bill.,10
2007-12-19,gwb,I appreciate very much the fact that we're going to fund additional research on new battery technologies to power plug-in hybrids.,7
2007-12-19,gwb,We're spending money on innovative ways to capture solar power.,5
2007-12-19,gwb,We're making—providing incentives for nuclear energy.,5
2007-12-19,gwb,"If we're serious about making sure we grow our economy and deal with greenhouse gases, we have got to expand nuclear power.",10
2007-12-19,gwb,It is going to take time to transition to this new era.,5
2007-12-19,gwb,And we're still going to need hydrocarbons.,2
2007-12-19,gwb,"And I hope the Congress will continue to open access to domestic energy sources: certain parts of the Outer Continental Shelf, in ANWR.",6
2007-12-19,gwb,"And to protect us against disruptions in our oil supply, I ask Congress to double the current capacity of the Strategic Petroleum Reserve.",6
2007-12-19,gwb,With these steps—particularly in the bill I'm about to sign—we're going to help American consumers a lot.,6
2007-12-19,gwb,"We'll help them by diversifying our supplies, which will help lower energy prices.",6
2007-12-19,gwb,We'll strengthen our security by helping to break our dependence on foreign oil.,7
2007-12-19,gwb,We'll do our duty to future generations by addressing climate change.,4
2007-12-19,gwb,And so I thank the Members of Congress.,3
2007-12-19,gwb,"I appreciate the fact that we've worked together, that we can show what's possible in addressing the big issues facing our Nation.",7
2007-12-19,gwb,"This is a good bill, and I'm pleased to sign it.",4
2003-05-28,gwb,Thank you all very much.,2
2003-05-28,gwb,"Good afternoon, and welcome to the White House.",4
2003-05-28,gwb,Today we are taking essential action to strengthen the American economy.,4
2003-05-28,gwb,"With my signature, the Jobs and Growth Tax Relief Reconciliation Act of 2003 will deliver substantial tax relief to 136 million American taxpayers.",6
2003-05-28,gwb,We are helping workers who need more take-home pay.,5
2003-05-28,gwb,We're helping seniors who rely on dividends.,4
2003-05-28,gwb,We're helping small-business owners looking to grow and to create more new jobs.,4
2003-05-28,gwb,We're helping families with children who will receive immediate relief.,5
2003-05-28,gwb,"By ensuring that Americans have more to spend, to save, and to invest, this legislation is adding fuel to an economic recovery.",6
2003-05-28,gwb,We have taken aggressive action to strengthen the foundation of our economy so that every American who wants to work will be able to find a job.,6
2003-05-28,gwb,I want to thank the members of my team who have worked so hard to get this bill to this desk.,7
2003-05-28,gwb,I particularly want to thank Secretary John Snow and Secretary Don Evans for their tireless efforts to convince members of both political parties what we're doing today is the right thing to do on behalf of all Americans.,8
2003-05-28,gwb,"I want to thank Steve Friedman for his good work, and his staff.",4
2003-05-28,gwb,"I want to thank Mitch Daniels, ""the Blade.""",4
2003-05-28,gwb,"I want to thank members of my Cabinet who are here, Secretary of Labor Elaine Chao and Mel Martinez.",5
2003-05-28,gwb,Thank you both for coming.,2
2003-05-28,gwb,I particularly want to thank the Members of the United States Congress who worked closely with the administration to do what was right for the American people.,9
2003-05-28,gwb,"Speaker Hastert—Speaker Denny Hastert isn't with us, but he put forth a monumental effort to get this bill done, as did Senate Majority Leader Bill Frist.",6
2003-05-28,gwb,"I'm particularly pleased that not only did the majority leader join me up here, but so does the chairman of the Ways and Means, Chairman Bill Thomas.",5
2003-05-28,gwb,"He got the job done along with Senator Chuck Grassley of Iowa, the Finance chairman in the Senate.",9
2003-05-28,gwb,"These two good men worked out differences in a quick period of time and got the bill to the respective bodies quickly, where both Republicans and Democrats supported this major piece of legislation.",5
2003-05-28,gwb,"I want to thank the Members from the United States House of Representatives who are with us today as well as Senator Thad Cochran, representing other Members of the Senate.",7
2003-05-28,gwb,We're honored you all are here.,4
2003-05-28,gwb,I want to thank all the Members who voted for this bill.,6
2003-05-28,gwb,We had great support in the House.,3
2003-05-28,gwb,"Senators Miller and Nelson also supported the Republican majority in the Senate, so that we can say loud and clear to the American people, ""You got more of your own money to spend so that this economy can get a good wind behind it.""",6
2003-05-28,gwb,I want to thank Dirk and members of the Tax Relief Coalition who rallied the grassroots all across the country to remind Members of the House and the Senate that there are people out there that understand that with tax relief will come more jobs for the American people.,15
2003-05-28,gwb,I appreciate members of the roundtables we had all around America.,6
2003-05-28,gwb,I see a lot of familiar faces from people that allowed me to come and listen to their stories and then translate those stories into the public arena so that our Congresspeople and citizens knew that behind every number there was a story to be told.,11
2003-05-28,gwb,I see small-business entrepreneurs and taxpayers and people who need dividends to help with their retirement.,6
2003-05-28,gwb,All of them stood up as we went around the country and spoke clearly— much more clearly than I can—about the need for tax relief.,7
2003-05-28,gwb,And I appreciate you all being here.,2
2003-05-28,gwb,"And I want to thank you for your care for our country, and welcome to the White House.",6
2003-05-28,gwb,The Jobs and Growth Act reduces Federal income taxes across the board.,3
2003-05-28,gwb,"And today the Internal Revenue Service will post new withholding tax tables so that employers can begin leaving more money in the paychecks of American workers, starting next month.",7
2003-05-28,gwb,"The Jobs and Growth Act increases the per-child tax credit from $600 to $1,000.",3
2003-05-28,gwb,So today I'm directing the Department of Treasury to issue checks of up to $400 per child to 25 million eligible families.,6
2003-05-28,gwb,And those checks will begin arriving in July.,3
2003-05-28,gwb,"This combination of income-tax rate reductions, a higher child credit, and a reduction in the marriage penalty will make a difference for families in every part of this country.",8
2003-05-28,gwb,"A family of four with a total income of $75,000 will receive a 19-percent reduction in Federal income taxes, saving $1,122 per year, per family.",6
2003-05-28,gwb,"A family of four with an income of $40,000 will see their income taxes drop from $1,178 to $45, a 96-percent tax cut.",6
2003-05-28,gwb,"And under this new law, 3 million individuals and families will have their Federal income-tax liability completely eliminated.",4
2003-05-28,gwb,"Altogether, 34 million families with children, including 6 million single moms, will receive an average tax cut of $1,549 per year.",5
2003-05-28,gwb,"Jenny Theisen, from Omaha, Nebraska, is here with us today.",4
2003-05-28,gwb,"Jenny's husband, David, is a staff sergeant based at Offutt Air Force Base and right now on duty in the Pacific and the Indian Ocean.",6
2003-05-28,gwb,"Jenny and David work hard to provide for their children, just like a lot of other Americans do as well, and right now Jenny says she tries to save $200 a month for her girls' college savings account.",7
2003-05-28,gwb,"But sometimes other bills have to be paid first, is what she says.",3
2003-05-28,gwb,"Under this proposal, under the bill I sign, it's going to be a lot easier for the Theisen family to save for the future because they will keep an extra $1,300 a year of their own money.",7
2003-05-28,gwb,Tax relief matters a lot to the average citizen here in America.,5
2003-05-28,gwb,"This tax bill will make it easier for moms and dads to save for their children's education, and that's vitally important for the future of this country.",7
2003-05-28,gwb,The benefits of the Jobs and Growth Act will also go to investors.,5
2003-05-28,gwb,"The top capital gains tax rate will be reduced by 25 percent, which will encourage more investment and risktaking, and that will help in job creation.",5
2003-05-28,gwb,The bill also allows for dividend income to be taxed at a lower rate.,4
2003-05-28,gwb,"This will encourage more companies to pay dividends, which in itself will not only be good for investors but will be a corporate reform measure.",7
2003-05-28,gwb,It's hard to pay dividends unless you've actually got cashflow.,2
2003-05-28,gwb,"The days when people could say, ""Invest with me because the sky's the limit,"" will be changed by dividend policy.",5
2003-05-28,gwb,It's hard to promote the sky being the limit and pay dividends unless you're actually profitable and have cashflow.,5
2003-05-28,gwb,Getting—reducing the tax rate on dividends will also increase the wealth effect around America and will help our markets.,4
2003-05-28,gwb,"And the good news is, a lot of senior citizens rely on dividend income to meet their daily needs, and under this legislation, 12 million seniors will receive an average tax reduction of $1,401.",6
2003-05-28,gwb,We're delivering substantial tax relief to small-business owners and entrepreneurs.,4
2003-05-28,gwb,"Most small-business owners are Subchapter S—own Subchapter S corporations or sole proprietorships or limited partnerships, so the small business pays taxes at the individual tax rate.",5
2003-05-28,gwb,"By cutting individual tax rates and by delivering other incentives for investment in new equipment, 23 million small-business owners will receive an average tax cut of $2,209.",8
2003-05-28,gwb,"This law reflects a commonsense economic principle: The best way to have more jobs is to help the people who create new jobs, and those are the small-business owners of America.",5
2003-05-28,gwb,Scott Harding is with us today.,2
2003-05-28,gwb,"He's the CEO of a family-owned electrical contracting business in Rockville, Maryland.",6
2003-05-28,gwb,Scott's company is a Sub S company.,3
2003-05-28,gwb,"He spends more than $100,000 a year on new equipment.",3
2003-05-28,gwb,"His savings under the tax relief will let him keep $7,300 of his own money, and his business will save at least $12,000 because of this legislation's increased expensing rules.",5
2003-05-28,gwb,"His savings, plus those of the other people who own this company, will help this company buy more equipment for their 50 employees, which will make the employees more productive, which will make it more likely that he'll be able to expand the number of employees who works for him.",14
2003-05-28,gwb,"Scott says, ""The more money we make, the bigger bonuses there are for workers.",5
2003-05-28,gwb,"It's that simple.""",2
2003-05-28,gwb,"No matter how complicated tax policy may seem here in Washington, people like Scott understand it all too well.",4
2003-05-28,gwb,"If businesses keep more of their own money, their workers benefit right away.",5
2003-05-28,gwb,"By leaving families and entrepreneurs more to spend, more to save, more to invest, these reforms will help boost the entire economy and create jobs.",4
2003-05-28,gwb,"When people have more money, they can spend it on goods and services.",3
2003-05-28,gwb,"And in our society, when they demand an additional good or a service, somebody will produce the good or a service.",4
2003-05-28,gwb,"And when somebody produces that good or a service, it means somebody is more likely to be able to find a job.",7
2003-05-28,gwb,"Increased hiring happens gradually, but we're on the path to greater job creation across this country.",6
2003-05-28,gwb,We know that tax relief is going to help this economy because it has done so in the past.,6
2003-05-28,gwb,The tax relief we passed in 2001 helped make the recession one of the shallowest in American history.,7
2003-05-28,gwb,It gave millions of families needed relief during a difficult time for our country.,6
2003-05-28,gwb,It helped many entrepreneurs to pursue their dreams.,3
2003-05-28,gwb,"I recently got a letter from Rusty Loiselle, who lives in Illinois.",6
2003-05-28,gwb,"Rusty had seen some hard times, but he always had a dream to start his own business and to be his own boss.",6
2003-05-28,gwb,He says the tax relief in 2001 helped him create a small custom painting business.,5
2003-05-28,gwb,"He bought a computer, some airbrushes, lights, and sanders, and he's done well.",4
2003-05-28,gwb,He's done well enough to be able to buy himself a home for he and his son.,9
2003-05-28,gwb,"He said, ""It probably doesn't sound much like—sound like much to you all, but it means a lot to my son and me.""",5
2003-05-28,gwb,"That's what America's all about, providing opportunity.",4
2003-05-28,gwb,The bill I'm going to sign provides opportunity for millions of Americans across this country.,6
2003-05-28,gwb,"And the more opportunity there is, the more likely it is somebody is going to find work in this country.",7
2003-05-28,gwb,This legislation is a major step forward in our economic agenda.,3
2003-05-28,gwb,Yet other steps are also needed.,2
2003-05-28,gwb,We must hold Federal spending to a responsible level.,3
2003-05-28,gwb,"Our budget for this year calls for discretionary spending to rise only 4 percent, or as much as the average household income will go up this year.",6
2003-05-28,gwb,Government should follow the example of American families by setting clear priorities and by staying within them.,5
2003-05-28,gwb,We must act in other areas to ensure the economic security of American families and workers.,5
2003-05-28,gwb,There could be no economic security unless people can count on affordable health care.,4
2003-05-28,gwb,Critical measures before Congress would address this issue.,3
2003-05-28,gwb,"Our country must get a handle on rising health care costs, so we must pass reforms to end the junk lawsuits that drive good doctors out of practice and drive the costs up for everybody.",6
2003-05-28,gwb,The biggest threat to economic security of our seniors is the affordability of prescription drugs.,6
2003-05-28,gwb,We must make available a prescription drug benefit to all our seniors.,4
2003-05-28,gwb,And we must assure that the commitments of Medicare are kept to every future generation of Americans.,5
2003-05-28,gwb,"To enhance economic security for working people throughout the economy, we must reduce the burden of regulation and litigation on small businesses as well.",7
2003-05-28,gwb,Employers don't want to spend their time and resources filling out forms or fighting junk lawsuits.,5
2003-05-28,gwb,They want to be out on the shop floor or behind the cash register creating profits and jobs.,7
2003-05-28,gwb,And that is why this administration has launched a task force to find ways to reduce paperwork for small-business owners in America.,9
2003-05-28,gwb,"We must enact regulatory and lawsuit reforms so that our business owners can do what they do best, create jobs.",3
2003-05-28,gwb,We must also help build economic security for workers by preparing citizens to fill the new jobs this economy will create.,8
2003-05-28,gwb,We're aggressively implementing higher standards in our public schools so that every child—every child—learns to read and write and add and subtract.,5
2003-05-28,gwb,"We've increased funding for Pell grants, making higher education a possibility for more young Americans.",5
2003-05-28,gwb,I've proposed innovative reemployment accounts to help unemployed workers cover the cost of job training or relocation.,6
2003-05-28,gwb,"For those currently unemployed, earlier today I signed legislation extending unemployment insurance benefits for an additional 13 weeks.",5
2003-05-28,gwb,"And when we reauthorize welfare reform, we must make sure that more and more Americans are set on the path of work, which is the path of dignity and independence.",9
2003-05-28,gwb,"I'm confident we can make progress in all these areas, because the Congress is showing the good will and hard work that makes progress possible.",6
2003-05-28,gwb,Already we've achieved many of the goals that I outlined last January.,6
2003-05-28,gwb,"Congress passed a budget resolution that follows my call to restore spending discipline to Washington, DC.",7
2003-05-28,gwb,We passed a focused supplemental spending bill to support our brave men and women in uniform.,4
2003-05-28,gwb,We passed a Global AIDS Initiative to help millions of people fighting for their lives.,6
2003-05-28,gwb,And now we have passed a bold package of tax relief for America's families and businesses which will help turn our recovery into a lasting expansion that reaches every single corner of America.,9
2003-05-28,gwb,"I believe in the future of this economy, in our Nation, because I know the character of the American people.",5
2003-05-28,gwb,"In 20 months, Americans have been tested by a national emergency, corporate scandals, war, and recession.",5
2003-05-28,gwb,"And time after time, we've responded effectively to the challenges we have faced.",4
2003-05-28,gwb,"Time after time, Americans have shown a firm resolve and an unshakable faith in our future.",5
2003-05-28,gwb,"And now, with this bold legislation, we're sending a clear message to the doubters, the doubters that Washington can respond.",3
2003-05-28,gwb,We can respond.,1
2003-05-28,gwb,We can respond in a positive way.,3
2003-05-28,gwb,We're building on the strengths of our economy so that everybody who wants to work can find a job in this great country.,5
2003-05-28,gwb,Congratulations to the Members of the United States Congress for rising to the challenge.,6
2003-05-28,gwb,May God bless America.,1
2002-01-08,gwb,Thank you all very much.,2
2002-01-08,gwb,Okay.,1
2002-01-08,gwb,I know you all are anxious to get back to class.,6
2002-01-08,gwb,So please be seated.,1
2002-01-08,gwb,Thank you for such a warm welcome.,3
2002-01-08,gwb,"It's great to be in the home of the Big Blue, Hamilton High School.",7
2002-01-08,gwb,I want to thank you all for coming.,3
2002-01-08,gwb,"I particularly want to thank my friend the Governor of the great State of Ohio, Governor Taft, for being here.",7
2002-01-08,gwb,I want to thank Tracey Miller for being so hospitable.,5
2002-01-08,gwb,I want to thank all who have come to witness this historic moment.,6
2002-01-08,gwb,"For those of you who have studied the history of our Government, you know most bills are signed at the White House.",7
2002-01-08,gwb,"But I decided to sign this bill in one of the most important places in America, a public school.",9
2002-01-08,gwb,We've got large challenges here in America.,3
2002-01-08,gwb,"There's no greater challenge than to make sure that every child—and all of us on this stage mean every child, not just a few children—every single child, regardless of where they live, how they're raised, the income level of their family, every child receive a first-class education in America.",10
2002-01-08,gwb,"And as you know, we've got another challenge, and that's to protect America from evil ones.",5
2002-01-08,gwb,"And I want to assure the seniors and juniors and sophomores here at Hamilton High School that the effort that this great country is engaged in, the effort to defend freedom and to defend our people, the effort to rout out terror wherever it exists, is noble and just and right, and your great country will prevail in this effort.",8
2002-01-08,gwb,I long for peace.,2
2002-01-08,gwb,"But I also understand that if we do not lead the world against terror, that your children and your grandchildren will not grow up in a society that is as free as the society we have today.",9
2002-01-08,gwb,Freedom is the precious gift that one generation can pass to the next.,5
2002-01-08,gwb,It is a gift and a promise that I intend to keep to the American children.,7
2002-01-08,gwb,And we owe the children of America a good education.,3
2002-01-08,gwb,"And today begins a new era, a new time in public education in our country.",6
2002-01-08,gwb,"As of this hour, America's schools will be on a new path of reform and a new path of results.",5
2002-01-08,gwb,Our schools will have higher expectations.,2
2002-01-08,gwb,We believe every child can learn.,3
2002-01-08,gwb,Our schools will have greater resources to help meet those goals.,4
2002-01-08,gwb,Parents will have more information about the schools and more say in how their children are educated.,5
2002-01-08,gwb,"From this day forward, all students will have a better chance to learn, to excel, and to live out their dreams.",6
2002-01-08,gwb,"I want to thank the Secretary of Education, Rod Paige, for being here and for his leadership.",5
2002-01-08,gwb,"I asked Rod to join my administration because I wanted somebody who understood what it meant to run a school district in Washington, DC.",9
2002-01-08,gwb,I didn't need somebody that based his knowledge on theory; I wanted somebody who based his knowledge on experience.,6
2002-01-08,gwb,"And Rod was a teacher, a school board member, and the superintendent of the Houston Independent School District.",7
2002-01-08,gwb,"He did a fine job there, and he's doing a fine job in Washington.",3
2002-01-08,gwb,"Reaching this moment has not been easy, as you could tell from Chairman Boehner's discussion.",5
2002-01-08,gwb,But we made it because of the willingness of four fine leaders to do what was right for America.,7
