date,source,sentence,depth
2004-01-20,gwb,"Many of our troops are listening tonight, and I want you and your families to know: America is proud of you, and my administration and this Congress will give you the resources you need to fight and win the war on terror.",10
2004-01-20,gwb,I know that some people question if America is really in a war at all.,6
2004-01-20,gwb,"They view terrorism more as a crime, a problem to be solved mainly with law enforcement and indictments.",5
2004-01-20,gwb,"After the World Trade Center was first attacked in 1993, some of the guilty were indicted and tried and convicted and sent to prison.",5
2004-01-20,gwb,But the matter was not settled.,2
2004-01-20,gwb,The terrorists were still training and plotting in other nations and drawing up more ambitious plans.,5
2004-01-20,gwb,"After the chaos and carnage of September the 11th, it is not enough to serve our enemies with legal papers.",5
2004-01-20,gwb,"The terrorists and their supporters declared war on the United States, and war is what they got.",4
2004-01-20,gwb,Some in this Chamber and in our country did not support the liberation of Iraq.,5
2004-01-20,gwb,"Objections to war often come from principled motives, but let us be candid about the consequences of leaving Saddam Hussein in power.",9
2004-01-20,gwb,We're seeking all the facts.,2
2004-01-20,gwb,"Already, the Kay Report identified dozens of weapons-of-mass-destruction-related program activities and significant amounts of equipment that Iraq concealed from the United Nations.",8
2004-01-20,gwb,"Had we failed to act, the dictator's weapons of mass destruction programs would continue to this day.",5
2004-01-20,gwb,"Had we failed to act, Security Council resolutions on Iraq would have been revealed as empty threats, weakening the United Nations and encouraging defiance by dictators around the world.",8
2004-01-20,gwb,"Iraq's torture chambers would still be filled with victims, terrified and innocent.",4
2004-01-20,gwb,"The killing fields of Iraq, where hundreds of thousands of men and women and children vanished into the sands, would still be known only to the killers.",7
2004-01-20,gwb,"For all who love freedom and peace, the world without Saddam Hussein's regime is a better and safer place.",5
2004-01-20,gwb,Some critics have said our duties in Iraq must be internationalized.,4
2004-01-20,gwb,"This particular criticism is hard to explain to our partners in Britain, Australia, Japan, South Korea, the Philippines, Thailand, Italy, Spain, Poland, Denmark, Hungary, Bulgaria, Ukraine, Romania, the Netherlands, Norway, El Salvador, and the 17 other countries that have committed troops to Iraq.",22
2004-01-20,gwb,"As we debate at home, we must never ignore the vital contributions of our international partners or dismiss their sacrifices.",4
2004-01-20,gwb,"From the beginning, America has sought international support for our operations in Afghanistan and Iraq, and we have gained much support.",6
2004-01-20,gwb,"There is a difference, however, between leading a coalition of many nations and submitting to the objections of a few.",8
2004-01-20,gwb,America will never seek a permission slip to defend the security of our country.,5
2004-01-20,gwb,"We also hear doubts that democracy is a realistic goal for the greater Middle East, where freedom is rare.",7
2004-01-20,gwb,Yet it is mistaken and condescending to assume that whole cultures and great religions are incompatible with liberty and self-government.,9
2004-01-20,gwb,"I believe that God has planted in every human heart the desire to live in freedom, and even when that desire is crushed by tyranny for decades, it will rise again.",5
2004-01-20,gwb,"As long as the Middle East remains a place of tyranny and despair and anger, it will continue to produce men and movements that threaten the safety of America and our friends.",8
2004-01-20,gwb,So America is pursuing a forward strategy of freedom in the greater Middle East.,4
2004-01-20,gwb,"We will challenge the enemies of reform, confront the allies of terror, and expect a higher standard from our friend.",6
2004-01-20,gwb,"To cut through the barriers of hateful propaganda, the Voice of America and other broadcast services are expanding their programming in Arabic and Persian, and soon a new television service will begin providing reliable news and information across the region.",6
2004-01-20,gwb,"I will send you a proposal to double the budget of the National Endowment for Democracy and to focus its new work on the development of free elections and free markets, free press, and free labor unions in the Middle East.",14
2004-01-20,gwb,"And above all, we will finish the historic work of democracy in Afghanistan and Iraq so those nations can light the way for others and help transform a troubled part of the world.",7
2004-01-20,gwb,"America is a nation with a mission, and that mission comes from our most basic beliefs.",5
2004-01-20,gwb,"We have no desire to dominate, no ambitions of empire.",3
2004-01-20,gwb,"Our aim is a democratic peace, a peace founded upon the dignity and rights of every man and woman.",8
2004-01-20,gwb,"America acts in this cause with friends and allies at our side, yet we understand our special calling: This great Republic will lead the cause of freedom.",5
2004-01-20,gwb,"In the last 3 years, adversity has also revealed the fundamental strengths of the American economy.",4
2004-01-20,gwb,We have come through recession and terrorist attack and corporate scandals and the uncertainties of war.,5
2004-01-20,gwb,"And because you acted to stimulate our economy with tax relief, this economy is strong and growing stronger.",5
2004-01-20,gwb,"You have doubled the child tax credit from 500 to $1,000, reduced the marriage penalty, begun to phase out the death tax, reduced taxes on capital gains and stock dividends, cut taxes on small businesses, and you have lowered taxes for every American who pays income taxes.",7
2004-01-20,gwb,"Americans took those dollars and put them to work, driving this economy forward.",4
2004-01-20,gwb,"The pace of economic growth in the third quarter of 2003 was the fastest in nearly 20 years; new home construction, the highest in almost 20 years; homeowner-ship rates, the highest ever.",6
2004-01-20,gwb,Manufacturing activity is increasing.,2
2004-01-20,gwb,Inflation is low.,1
2004-01-20,gwb,Interest rates are low.,2
2004-01-20,gwb,Exports are growing.,1
2004-01-20,gwb,"Productivity is high, and jobs are on the rise.",4
2004-01-20,gwb,"These numbers confirm that the American people are using their money far better than Government would have, and you were right to return it.",4
2004-01-20,gwb,America's growing economy is also a changing economy.,3
2004-01-20,gwb,"As technology transforms the way almost every job is done, America becomes more productive and workers need new skills.",6
2004-01-20,gwb,Much of our job growth will be found in high-skilled fields like health care and biotechnology.,5
2004-01-20,gwb,So we must respond by helping more Americans gain the skills to find good jobs in our new economy.,7
2004-01-20,gwb,"All skills begin with the basics of reading and math, which are supposed to be learned in the early grades of our schools.",9
2004-01-20,gwb,"Yet for too long, for too many children, those skills were never mastered.",4
2004-01-20,gwb,"By passing the No Child Left Behind Act, you have made the expectation of literacy the law of our country.",6
2004-01-20,gwb,"We're providing more funding for our schools, a 36-percent increase since 2001.",4
2004-01-20,gwb,We're requiring higher standards.,2
2004-01-20,gwb,We are regularly testing every child on the fundamentals.,3
2004-01-20,gwb,We are reporting results to parents and making sure they have better options when schools are not performing.,5
2004-01-20,gwb,We are making progress toward excellence for every child in America.,4
2004-01-20,gwb,But the status quo always has defenders.,2
2004-01-20,gwb,Some want to undermine the No Child Left Behind Act by weakening standards and accountability.,5
2004-01-20,gwb,"Yet the results we require are really a matter of common sense: We expect third graders to read and do math at the third grade level, and that's not asking too much.",6
2004-01-20,gwb,Testing is the only way to identify and help students who are falling behind.,6
2004-01-20,gwb,This Nation will not go back to the days of simply shuffling children along from grade to grade without them learning the basics.,9
2004-01-20,gwb,"I refuse to give up on any child, and the No Child Left Behind Act is opening the door of opportunity to all of America's children.",7
2004-01-20,gwb,"At the same time, we must ensure that older students and adults can gain the skills they need to find work now.",5
2004-01-20,gwb,Many of the fastest growing occupations require strong math and science preparation and training beyond the high school level.,5
2004-01-20,gwb,"So tonight, I propose a series of measures called Jobs for the 21st Century.",7
2004-01-20,gwb,"This program will provide extra help to middle and high school students who fall behind in reading and math, expand advanced placement programs in low-income schools, invite math and science professionals from the private sector to teach part-time in our high schools.",6
2004-01-20,gwb,I propose larger Pell grants for students who prepare for college with demanding courses in high school.,10
2004-01-20,gwb,"I propose increasing our support for America's fine community colleges, so they can—I do so, so they can train workers for industries that are creating the most new jobs.",8
2004-01-20,gwb,"By all these actions, we'll help more and more Americans to join in the growing prosperity of our country.",6
2004-01-20,gwb,"Job training is important, and so is job creation.",3
2004-01-20,gwb,"We must continue to pursue an aggressive, progrowth economic agenda.",3
2004-01-20,gwb,Congress has some unfinished business on the issue of taxes.,5
2004-01-20,gwb,The tax reductions you passed are set to expire.,3
2004-01-20,gwb,"Unless you act, the unfair tax on marriage will go back up.",3
2004-01-20,gwb,"Unless you act, millions of families will be charged $300 more in Federal taxes for every child.",3
2004-01-20,gwb,"Unless you act, small businesses will pay higher taxes.",2
2004-01-20,gwb,"Unless you act, the death tax will eventually come back to life.",3
2004-01-20,gwb,"Unless you act, Americans face a tax increase.",2
2004-01-20,gwb,"What Congress has given, the Congress should not take away.",2
2004-01-20,gwb,"For the sake of job growth, the tax cuts you passed should be permanent.",5
2004-01-20,gwb,Our agenda for jobs and growth must help small-business owners and employees with relief from needless Federal regulation and protect them from junk and frivolous lawsuits.,5
2004-01-20,gwb,"Consumers and businesses need reliable supplies of energy to make our economy run, so I urge you to pass legislation to modernize our electricity system, promote conservation, and make America less dependent on foreign sources of energy.",7
2004-01-20,gwb,"My administration is promoting free and fair trade to open up new markets for America's entrepreneurs and manufacturers and farmers, to create jobs for American workers.",7
2004-01-20,gwb,Younger workers should have the opportunity to build a nest egg by saving part of their Social Security taxes in a personal retirement account.,9
2004-01-20,gwb,We should make the Social Security system a source of ownership for the American people.,6
2004-01-20,gwb,And we should limit the burden of Government on this economy by acting as good stewards of taxpayers' dollars.,8
2004-01-20,gwb,"In 2 weeks, I will send you a budget that funds the war, protects the homeland, and meets important domestic needs while limiting the growth in discretionary spending to less than 4 percent.",7
2004-01-20,gwb,"This will require that Congress focus on priorities, cut wasteful spending, and be wise with the people's money.",8
2004-01-20,gwb,"By doing so, we can cut the deficit in half over the next 5 years.",3
2004-01-20,gwb,Tonight I also ask you to reform our immigration laws so they reflect our values and benefit our economy.,4
2004-01-20,gwb,I propose a new temporary-worker program to match willing foreign workers with willing employers when no Americans can be found to fill the job.,6
2004-01-20,gwb,This reform will be good for our economy because employers will find needed workers in an honest and orderly system.,5
2004-01-20,gwb,"A temporary-worker program will help protect our homeland, allowing Border Patrol and law enforcement to focus on true threats to our national security.",7
2004-01-20,gwb,"I oppose amnesty, because it would encourage further illegal immigration and unfairly reward those who break our laws.",6
2004-01-20,gwb,My temporary-worker program will preserve the citizenship path for those who respect the law while bringing millions of hard-working men and women out from the shadows of American life.,11
2004-01-20,gwb,"Our Nation's health care system, like our economy, is also in a time of change.",4
2004-01-20,gwb,Amazing medical technologies are improving and saving lives.,2
2004-01-20,gwb,"This dramatic progress has brought its own challenge, in the rising costs of medical care and health insurance.",6
2004-01-20,gwb,"Members of Congress, we must work together to help control those costs and extend the benefits of modern medicine throughout our country.",7
2004-01-20,gwb,"Meeting these goals requires bipartisan effort, and 2 months ago, you showed the way.",4
2004-01-20,gwb,"By strengthening Medicare and adding a prescription drug benefit, you kept a basic commitment to our seniors.",5
2004-01-20,gwb,You are giving them the modern medicine they deserve.,3
2004-01-20,gwb,"Starting this year, under the law you passed, seniors can choose to receive a drug discount card, saving them 10 to 25 percent off the retail price of most prescription drugs, and millions of low-income seniors can get an additional $600 to buy medicine.",7
2004-01-20,gwb,"Beginning next year, seniors will have new coverage for preventive screenings against diabetes and heart disease, and seniors just entering Medicare can receive wellness exams.",7
2004-01-20,gwb,"In January of 2006, seniors can get prescription drug coverage under Medicare.",4
2004-01-20,gwb,"For a monthly premium of about $35, most seniors who do not have that coverage today can expect to see their drug bills cut roughly in half.",5
2004-01-20,gwb,"Under this reform, senior citizens will be able to keep their Medicare just as it is, or they can choose a Medicare plan that fits them best, just as you, as Members of Congress, can choose an insurance plan that meets your needs.",6
2004-01-20,gwb,"And starting this year, millions of Americans will be able to save money tax-free for their medical expenses in a health savings account.",8
2004-01-20,gwb,"I signed this measure proudly, and any attempt to limit the choices of our seniors or to take away their prescription drug coverage under Medicare will meet my veto.",6
2004-01-20,gwb,"On the critical issue of health care, our goal is to ensure that Americans can choose and afford private health care coverage that best fits their individual needs.",7
2004-01-20,gwb,"To make insurance more affordable, Congress must act to address rapidly rising health care costs.",4
2004-01-20,gwb,"Small businesses should be able to band together and negotiate for lower insurance rates, so they can cover more workers with health insurance.",7
2004-01-20,gwb,I urge you to pass association health plans.,3
2004-01-20,gwb,I ask you to give lower income Americans a refundable tax credit that would allow millions to buy their own basic health insurance.,6
2004-01-20,gwb,"By computerizing health records, we can avoid dangerous medical mistakes, reduce costs, and improve care.",4
2004-01-20,gwb,"To protect the doctor-patient relationship and keep good doctors doing good work, we must eliminate wasteful and frivolous medical lawsuits.",6
2004-01-20,gwb,And tonight I propose that individuals who buy catastrophic health care coverage as part of our new health savings accounts be allowed to deduct 100 percent of the premiums from their taxes.,9
2004-01-20,gwb,A Government-run health care system is the wrong prescription.,3
2004-01-20,gwb,"By keeping costs under control, expanding access, and helping more Americans afford coverage, we will preserve the system of private medicine that makes America's health care the best in the world.",7
2004-01-20,gwb,"We are living in a time of great change in our world, in our economy, in science and medicine.",7
2004-01-20,gwb,"Yet some things endure: courage and compassion, reverence and integrity, respect for differences of faith and race.",7
2004-01-20,gwb,"The values we try to live by never change, and they are instilled in us by fundamental institutions such as families and schools and religious congregations.",8
2004-01-20,gwb,"These institutions, these unseen pillars of civilization, must remain strong in America, and we will defend them.",4
2004-01-20,gwb,"We must stand with our families to help them raise healthy, responsible children.",4
2004-01-20,gwb,"When it comes to helping children make right choices, there is work for all of us to do.",6
2004-01-20,gwb,One of the worst decisions our children can make is to gamble their lives and futures on drugs.,6
2004-01-20,gwb,"Our Government is helping parents confront this problem with aggressive education, treatment, and law enforcement.",6
2004-01-20,gwb,Drug use in high school has declined by 11 percent over the last 2 years.,4
2004-01-20,gwb,Four hundred thousand fewer young people are using illegal drugs than in the year 2001.,4
2004-01-20,gwb,"In my budget, I propose new funding to continue our aggressive, community-based strategy to reduce demand for illegal drugs.",6
2004-01-20,gwb,Drug testing in our schools has proven to be an effective part of this effort.,5
2004-01-20,gwb,So tonight I propose an additional 23 million for schools that want to use drug testing as a tool to save children's lives.,11
2004-01-20,gwb,"The aim here is not to punish children but to send them this message: We love you, and we do not want to lose you.",5
2004-01-20,gwb,"To help children make right choices, they need good examples.",4
2004-01-20,gwb,"Athletics play such an important role in our society, but unfortunately, some in professional sports are not setting much of an example.",5
2004-01-20,gwb,"The use of performance-enhancing drugs like steroids in baseball, football, and other sports is dangerous, and it sends the wrong message, that there are shortcuts to accomplishment and that performance is more important than character.",8
2004-01-20,gwb,"So tonight I call on team owners, union representatives, coaches, and players to take the lead, to send the right signal, to get tough, and to get rid of steroids now.",7
2004-01-20,gwb,"To encourage right choices, we must be willing to confront the dangers young people face, even when they're difficult to talk about.",6
2004-01-20,gwb,"Each year, about 3 million teenagers contract sexually transmitted diseases that can harm them or kill them or prevent them from ever becoming parents.",6
2004-01-20,gwb,"In my budget, I propose a grassroots campaign to help inform families about these medical risks.",5
2004-01-20,gwb,"We will double Federal funding for abstinence programs, so schools can teach this fact of life: Abstinence for young people is the only certain way to avoid sexually transmitted diseases.",6
2004-01-20,gwb,Decisions children now make can affect their health and character for the rest of their lives.,6
2004-01-20,gwb,"All of us, parents and schools and government, must work together to counter the negative influence of the culture and to send the right messages to our children.",6
2004-01-20,gwb,A strong America must also value the institution of marriage.,3
2004-01-20,gwb,"I believe we should respect individuals as we take a principled stand for one of the most fundamental, enduring institutions of our civilization.",9
2004-01-20,gwb,"Congress has already taken a stand on this issue by passing the Defense of Marriage Act, signed in 1996 by President Clinton.",7
2004-01-20,gwb,That statute protects marriage under Federal law as a union of a man and a woman and declares that one State may not redefine marriage for other States.,6
2004-01-20,gwb,"Activist judges, however, have begun redefining marriage by court order, without regard for the will of the people and their elected representatives.",8
2004-01-20,gwb,"On an issue of such great consequence, the people's voice must be heard.",5
2004-01-20,gwb,"If judges insist on forcing their arbitrary will upon the people, the only alternative left to the people would be the constitutional process.",6
2004-01-20,gwb,Our Nation must defend the sanctity of marriage.,3
2004-01-20,gwb,"The outcome of this debate is important, and so is the way we conduct it.",4
2004-01-20,gwb,The same moral tradition that defines marriage also teaches that each individual has dignity and value in God's sight.,5
2004-01-20,gwb,It's also important to strengthen our communities by unleashing the compassion of America's religious institutions.,8
2004-01-20,gwb,"Religious charities of every creed are doing some of the most vital work in our country: mentoring children, feeding the hungry, taking the hand of the lonely.",7
2004-01-20,gwb,"Yet Government has often denied social service grants and contracts to these groups, just because they have a cross or a Star of David or a crescent on the wall.",7
2004-01-20,gwb,"By Executive order, I have opened billions of dollars in grant money to competition that includes faith-based charities.",8
2004-01-20,gwb,"Tonight I ask you to codify this into law, so people of faith can know that the law will never discriminate against them again.",4
2004-01-20,gwb,"In the past, we've worked together to bring mentors to children of prisoners and provide treatment for the addicted and help for the homeless.",9
2004-01-20,gwb,Tonight I ask you to consider another group of Americans in need of help.,5
2004-01-20,gwb,"This year, some 600,000 inmates will be released from prison back into society.",3
2004-01-20,gwb,"We know from long experience that if they can't find work or a home or help, they are much more likely to commit crime and return to prison.",6
2004-01-20,gwb,"So tonight I propose a 4-year, $300 million prisoner reentry initiative to expand job training and placement services, to provide transitional housing, and to help newly released prisoners get mentoring, including from faith-based groups.",8
2004-01-20,gwb,"America is the land of second chance, and when the gates of the prison open, the path ahead should lead to a better life.",6
2004-01-20,gwb,"For all Americans, the last 3 years have brought tests we did not ask for and achievements shared by all.",5
2004-01-20,gwb,"By our actions, we have shown what kind of nation we are.",4
2004-01-20,gwb,"In grief, we have found the grace to go on.",3
2004-01-20,gwb,"In challenge, we rediscovered the courage and daring of a free people.",4
2004-01-20,gwb,"In victory, we have shown the noble aims and good heart of America.",4
2004-01-20,gwb,"And having come this far, we sense that we live in a time set apart.",5
2004-01-20,gwb,"I've been witness to the character of the people of America, who have shown calm in times of danger, compassion for one another, and toughness for the long haul.",10
2004-01-20,gwb,All of us have been partners in a great enterprise.,4
2004-01-20,gwb,And even some of the youngest understand that we are living in historic times.,4
2004-01-20,gwb,"Last month a girl in Lincoln, Rhode Island, sent me a letter.",5
2004-01-20,gwb,"It began, ""Dear George W. Bush.",2
2004-01-20,gwb,"If there's anything you know I, Ashley Pearson, age 10, can do to help anyone, please send me a letter and tell me what I can do to save our country.""",7
2004-01-20,gwb,She added this P.S.,2
2004-01-20,gwb,": ""If you can send a letter to the troops, please put, 'Ashley Pearson believes in you.""'",4
2004-01-20,gwb,"Tonight, Ashley, your message to our troops has just been conveyed.",5
2004-01-20,gwb,"And yes, you have some duties yourself: Study hard in school; listen to your mom or dad; help someone in need; and when you and your friends see a man or woman in uniform, say, ""Thank you.""",8
2004-01-20,gwb,"And Ashley, while you do your part, all of us here in this great Chamber will do our best to keep you and the rest of America safe and free.",5
2004-01-20,gwb,"My fellow citizens, we now move forward with confidence and faith.",3
2004-01-20,gwb,Our Nation is strong and steadfast.,2
2004-01-20,gwb,"The cause we serve is right, because it is the cause of all mankind.",5
2004-01-20,gwb,"The momentum of freedom in our world is unmistakable, and it is not carried forward by our power alone.",4
2004-01-20,gwb,We can trust in that greater power who guides the unfolding of the years.,7
2004-01-20,gwb,"And in all that is to come, we can know that His purposes are just and true.",5
2004-01-20,gwb,May God continue to bless America.,2
2007-01-23,gwb,Thank you very much.,2
2007-01-23,gwb,And tonight I have the high privilege and distinct honor of my own as the first President to begin the State of the Union message with these words: Madam Speaker.,5
2007-01-23,gwb,"In his day, the late Congressman Thomas D'Alesandro, Jr., from Baltimore, Maryland, saw Presidents Roosevelt and Truman at this rostrum.",4
2007-01-23,gwb,"But nothing could compare with the sight of his only daughter, Nancy, presiding tonight as Speaker of the House of Representatives.",11
2007-01-23,gwb,"Congratulations, Madam Speaker.",2
