date,source,sentence,depth
2008-05-22,gwb,"Most notably, the current agreement includes: $175 million to address water issues for desert lakes; $250 million for a 400,000-acre land purchase from a private owner; funding and authority for the noncompetitive sale of National Forest land to a ski resort; and $382 million earmarked for a specific watershed.",9
2008-05-22,gwb,Rural and urban Americans alike are frustrated with excessive government spending and the funneling of taxpayer funds for pet projects.,8
2008-05-22,gwb,Congress should seize the opportunity to eliminate wasteful spending.,4
2008-05-22,gwb,Congress should improve the farm bill or extend the current bill for at least one year.,6
2008-05-22,gwb,President Bush last week made clear that this is not the time to ask American families who are already paying more in the check-out line to pay more in subsidies to support a record-setting farm economy.,13
2008-05-22,gwb,"We celebrate the fact that our agriculture economy is doing well, but this is not the time to further increase subsidy rates while failing to target payments to farmers who need them.",10
2008-05-22,gwb,This bill jeopardizes America's support for farm programs.,4
2008-05-22,gwb,"Congress' Farm Bill Lacks Program Reform And Fiscal Discipline At a time when net farm income is projected to increase by more than $28 billion in one year, Congress should not increase farm subsidies and add to the subsidy rolls.",4
2008-05-22,gwb,The farm bill fails to adequately reform payment limitations and instead allows for excessively high limits on the level of allowable income for receiving farm subsidies.,9
2008-05-22,gwb,Net farm income is forecast to be 51 percent above its 10-year average.,5
2008-05-22,gwb,"The Administration originally proposed to lower to $200,000 the Adjusted Gross Income (AGI) limit for receiving farm program subsidies.",6
2008-05-22,gwb,Congress wants to allow subsidies to continue for farmers with AGI of up to $1.5 million.,7
2008-05-22,gwb,"Following passage of this legislation, it has become clear that a newly designed subsidy program, which is uncapped, could result in billions of dollars being made available to subsidize crops, locking in historically high price levels.",9
2008-05-22,gwb,The amount of the subsidy is tied to recent record prices.,4
2008-05-22,gwb,"If prices drop even 10 percent from these levels, the new program could increase taxpayer-financed payments to farmers by billions of dollars, despite still profitable crop prices.",4
2008-05-22,gwb,This provision is grossly inconsistent with the Administration's proposals for reform of subsidy payments.,8
2008-05-22,gwb,The farm bill will make it harder to get adequate food aid to hungry people by essentially locking-in aid dollars for non-emergency use.,7
2008-05-22,gwb,The bill also fails to include the Administration's proposal to add flexibility by allowing up to a quarter of the purchases by our largest food aid program to be made near crisis areas.,11
2008-05-22,gwb,This would allow us to provide more assistance faster and more efficiently.,4
2008-05-22,gwb,"The current agreement fails to deliver conservation results, cutting protection for new wetland acres by 36 percent compared to the 2002 Farm Bill, and eliminating seven million acres from protection under the conservation reserve program.",8
2008-05-22,gwb,"The bill fails to adequately protect vanishing native grasslands, making such protections optional for only a few states.",7
2005-01-20,gwb,"Vice President Cheney, Mr. Chief Justice, President Carter, President Bush, President Clinton, Members of the United States Congress, reverend clergy, distinguished guests, fellow citizens: On this day, prescribed by law and marked by ceremony, we celebrate the durable wisdom of our Constitution and recall the deep commitments that unite our country.",10
2005-01-20,gwb,"I am grateful for the honor of this hour, mindful of the consequential times in which we live, and determined to fulfill the oath that I have sworn and you have witnessed.",6
2005-01-20,gwb,"At this second gathering, our duties are defined not by the words I use but by the history we have seen together.",5
2005-01-20,gwb,"For a half a century, America defended our own freedom by standing watch on distant borders.",5
2005-01-20,gwb,"After the shipwreck of communism came years of relative quiet, years of repose, years of sabbatical, and then there came a day of fire.",6
2005-01-20,gwb,"We have seen our vulnerability, and we have seen its deepest source.",3
2005-01-20,gwb,"For as long as whole regions of the world simmer in resentment and tyranny, prone to ideologies that feed hatred and excuse murder, violence will gather and multiply in destructive power and cross the most defended borders and raise a mortal threat.",7
2005-01-20,gwb,"There is only one force of history that can break the reign of hatred and resentment and expose the pretensions of tyrants and reward the hopes of the decent and tolerant, and that is the force of human freedom.",8
2005-01-20,gwb,"We are led, by events and common sense, to one conclusion: The survival of liberty in our land increasingly depends on the success of liberty in other lands.",5
2005-01-20,gwb,The best hope for peace in our world is the expansion of freedom in all the world.,6
2005-01-20,gwb,America's vital interests and our deepest beliefs are now one.,3
2005-01-20,gwb,"From the day of our founding, we have proclaimed that every man and woman on this Earth has rights and dignity and matchless value, because they bear the image of the Maker of heaven and Earth.",8
2005-01-20,gwb,"Across the generations, we have proclaimed the imperative of self-government, because no one is fit to be a master and no one deserves to be a slave.",5
2005-01-20,gwb,Advancing these ideals is the mission that created our Nation.,4
2005-01-20,gwb,It is the honorable achievement of our fathers.,4
2005-01-20,gwb,"Now, it is the urgent requirement of our Nation's security and the calling of our time.",5
2005-01-20,gwb,"So it is the policy of the United States to seek and support the growth of democratic movements and institutions in every nation and culture, with the ultimate goal of ending tyranny in our world.",7
2005-01-20,gwb,"This is not primarily the task of arms, though we will defend ourselves and our friends by force of arms when necessary.",5
2005-01-20,gwb,"Freedom, by its nature, must be chosen and defended by citizens and sustained by the rule of law and the protection of minorities.",7
2005-01-20,gwb,"And when the soul of a nation finally speaks, the institutions that arise may reflect customs and traditions very different from our own.",5
2005-01-20,gwb,America will not impose our own style of government on the unwilling.,3
2005-01-20,gwb,"Our goal instead is to help others find their own voice, attain their own freedom, and make their own way.",5
2005-01-20,gwb,The great objective of ending tyranny is the concentrated work of generations.,4
2005-01-20,gwb,The difficulty of the task is no excuse for avoiding it.,4
2005-01-20,gwb,"America's influence is not unlimited, but fortunately for the oppressed, America's influence is considerable and we will use it confidently in freedom's cause.",6
2005-01-20,gwb,My most solemn duty is to protect this Nation and its people from further attacks and emerging threats.,5
2005-01-20,gwb,Some have unwisely chosen to test America's resolve and have found it firm.,4
2005-01-20,gwb,"We will persistently clarify the choice before every ruler and every nation, the moral choice between oppression, which is always wrong, and freedom, which is eternally right.",7
2005-01-20,gwb,America will not pretend that jailed dissidents prefer their chains or that women welcome humiliation and servitude or that any human being aspires to live at the mercy of bullies.,7
2005-01-20,gwb,We will encourage reform in other governments by making clear that success in our relations will require the decent treatment of their own people.,8
2005-01-20,gwb,America's belief in human dignity will guide our policies.,4
2005-01-20,gwb,Yet rights must be more than the grudging concessions of dictators.,5
2005-01-20,gwb,They are secured by free dissent and the participation of the governed.,6
2005-01-20,gwb,"In the long run, there is no justice without freedom and there can be no human rights without human liberty.",5
2005-01-20,gwb,"Some, I know, have questioned the global appeal of liberty, though this time in history, four decades defined by the swiftest advance of freedom ever seen, is an odd time for doubt.",9
2005-01-20,gwb,"Americans, of all people, should never be surprised by the power of our ideals.",5
2005-01-20,gwb,"Eventually, the call of freedom comes to every mind and every soul.",4
2005-01-20,gwb,We do not accept the existence of permanent tyranny because we do not accept the possibility of permanent slavery.,5
2005-01-20,gwb,Liberty will come to those who love it.,4
2005-01-20,gwb,"Today, America speaks anew to the peoples of the world.",5
2005-01-20,gwb,All who live in tyranny and hopelessness can know: The United States will not ignore your oppression or excuse your oppressors.,6
2005-01-20,gwb,"When you stand for your liberty, we will stand with you.",4
2005-01-20,gwb,"Democratic reformers facing repression, prison, or exile can know: America sees you for who you are, the future leaders of your free country.",6
2005-01-20,gwb,"The rulers of outlaw regimes can know that we still believe as Abraham Lincoln did: ""Those who deny freedom to others deserve it not for themselves and, under the rule of a just God, cannot long retain it.""",6
2005-01-20,gwb,"The leaders of governments with long habits of control need to know: To serve your people, you must learn to trust them.",5
2005-01-20,gwb,"Start on this journey of progress and justice, and America will walk at your side.",5
2005-01-20,gwb,And all the allies of the United States can know: We honor your friendship; we rely on your counsel; and we depend on your help.,5
2005-01-20,gwb,Division among free nations is a primary goal of freedom's enemies.,5
2005-01-20,gwb,The concerted effort of free nations to promote democracy is a prelude to our enemies' defeat.,5
2005-01-20,gwb,Today I also speak anew to my fellow citizens.,3
2005-01-20,gwb,"From all of you I have asked patience in the hard task of securing America, which you have granted in good measure.",9
2005-01-20,gwb,Our country has accepted obligations that are difficult to fulfill and would be dishonorable to abandon.,6
2005-01-20,gwb,"Yet because we have acted in the great liberating tradition of this Nation, tens of millions have achieved their freedom.",6
2005-01-20,gwb,"And as hope kindles hope, millions more will find it.",3
2005-01-20,gwb,"By our efforts, we have lit a fire as well, a fire in the minds of men.",5
2005-01-20,gwb,It warms those who feel its power.,4
2005-01-20,gwb,It burns those who fight its progress.,4
2005-01-20,gwb,And one day this untamed fire of freedom will reach the darkest corners of our world.,4
2005-01-20,gwb,"A few Americans have accepted the hardest duties in this cause, in the quiet work of intelligence and diplomacy, the idealistic work of helping raise up free governments, the dangerous and necessary work of fighting our enemies.",6
2005-01-20,gwb,"Some have shown their devotion to our country in deaths that honored their whole lives, and we will always honor their names and their sacrifice.",5
2005-01-20,gwb,All Americans have witnessed this idealism and some for the first time.,5
2005-01-20,gwb,I ask our youngest citizens to believe the evidence of your eyes.,5
2005-01-20,gwb,You have seen duty and allegiance in the determined faces of our soldiers.,6
2005-01-20,gwb,You have seen that life is fragile and evil is real and courage triumphs.,4
2005-01-20,gwb,"Make the choice to serve in a cause larger than your wants, larger than yourself, and in your days you will add not just to the wealth of our country but to its character.",9
2005-01-20,gwb,"America has need of idealism and courage because we have essential work at home, the unfinished work of American freedom.",5
2005-01-20,gwb,"In a world moving toward liberty, we are determined to show the meaning and promise of liberty.",5
2005-01-20,gwb,"In America's ideal of freedom, citizens find the dignity and security of economic independence instead of laboring on the edge of subsistence.",6
2005-01-20,gwb,"This is the broader definition of liberty that motivated the Homestead Act, the Social Security Act, and the GI bill of rights.",6
2005-01-20,gwb,And now we will extend this vision by reforming great institutions to serve the needs of our time.,7
2005-01-20,gwb,"To give every American a stake in the promise and future of our country, we will bring the highest standards to our schools and build an ownership society.",7
2005-01-20,gwb,"We will widen the ownership of homes and businesses, retirement savings, and health insurance, preparing our people for the challenges of life in a free society.",6
2005-01-20,gwb,"By making every citizen an agent of his or her own destiny, we will give our fellow Americans greater freedom from want and fear and make our society more prosperous and just and equal.",7
2005-01-20,gwb,"In America's ideal of freedom, the public interest depends on private character, on integrity and tolerance toward others and the rule of conscience in our own lives.",6
2005-01-20,gwb,"Self-government relies, in the end, on the governing of the self.",5
2005-01-20,gwb,"That edifice of character is built in families, supported by communities with standards, and sustained in our national life by the truths of Sinai, the Sermon on the Mount, the words of the Koran, and the varied faiths of our people.",10
2005-01-20,gwb,"Americans move forward in every generation by reaffirming all that is good and true that came before, ideals of justice and conduct that are the same yesterday, today, and forever.",6
2005-01-20,gwb,"In America's ideal of freedom, the exercise of rights is ennobled by service and mercy and a heart for the weak.",6
2005-01-20,gwb,Liberty for all does not mean independence from one another.,3
2005-01-20,gwb,Our Nation relies on men and women who look after a neighbor and surround the lost with love.,7
2005-01-20,gwb,"Americans, at our best, value the life we see in one another and must always remember that even the unwanted have worth.",5
2005-01-20,gwb,"And our country must abandon all the habits of racism, because we cannot carry the message of freedom and the baggage of bigotry at the same time.",5
2005-01-20,gwb,"From the perspective of a single day, including this day of dedication, the issues and questions before our country are many.",5
2005-01-20,gwb,"From the viewpoint of centuries, the questions that come to us are narrowed and few: Did our generation advance the cause of freedom?",4
2005-01-20,gwb,And did our character bring credit to that cause?,3
2005-01-20,gwb,"These questions that judge us also unite us, because Americans of every party and background, Americans by choice and by birth are bound to one another in the cause of freedom.",8
2005-01-20,gwb,"We have known divisions, which must be healed to move forward in great purposes, and I will strive in good faith to heal them.",6
2005-01-20,gwb,Yet those divisions do not define America.,2
2005-01-20,gwb,"We felt the unity and fellowship of our Nation when freedom came under attack, and our response came like a single hand over a single heart.",4
2005-01-20,gwb,And we can feel that same unity and pride whenever America acts for good and the victims of disaster are given hope and the unjust encounter justice and the captives are set free.,6
2005-01-20,gwb,"We go forward with complete confidence in the eventual triumph of freedom, not because history runs on the wheels of inevitability—it is human choices that move events; not because we consider ourselves a chosen nation—God moves and chooses as He wills.",7
2005-01-20,gwb,"We have confidence because freedom is the permanent hope of mankind, the hunger in dark places, the longing of the soul.",5
2005-01-20,gwb,"When our Founders declared a new order of the ages, when soldiers died in wave upon wave for a union based on liberty, when citizens marched in peaceful outrage under the banner ""Freedom Now,"" they were acting on an ancient hope that is meant to be fulfilled.",7
2005-01-20,gwb,"History has an ebb and flow of justice, but history also has a visible direction, set by liberty and the Author of Liberty.",7
2005-01-20,gwb,"When the Declaration of Independence was first read in public and the Liberty Bell was sounded in celebration, a witness said, ""It rang as if it meant something.""",5
2005-01-20,gwb,"In our time, it means something still.",3
2005-01-20,gwb,"America, in this young century, proclaims liberty throughout all the world and to all the inhabitants thereof.",5
2005-01-20,gwb,"Renewed in our strength, tested but not weary, we are ready for the greatest achievements in the history of freedom.",7
2005-01-20,gwb,"May God bless you, and may He watch over the United States of America.",5
2001-01-20,gwb,"Thank you, all.",1
2001-01-20,gwb,"Chief Justice Rehnquist, President Carter, President Bush, President Clinton, distinguished guests, and my fellow citizens.",4
2001-01-20,gwb,"The peaceful transfer of authority is rare in history, yet common in our country.",4
2001-01-20,gwb,"With a simple oath, we affirm old traditions and make new beginnings.",3
2001-01-20,gwb,"As I begin, I thank President Clinton for his service to our Nation, and I thank Vice President Gore for a contest conducted with spirit and ended with grace.",6
2001-01-20,gwb,"I am honored and humbled to stand here where so many of America's leaders have come before me, and so many will follow.",8
2001-01-20,gwb,"We have a place, all of us, in a long story, a story we continue but whose end we will not see.",4
2001-01-20,gwb,"It is a story of a new world that became a friend and liberator of the old, the story of a slaveholding society that became a servant of freedom, the story of a power that went into the world to protect but not possess, to defend but not to conquer.",9
2001-01-20,gwb,"It is the American story, a story of flawed and fallible people united across the generations by grand and enduring ideals.",9
2001-01-20,gwb,"The grandest of these ideals is an unfolding American promise that everyone belongs, that everyone deserves a chance, that no insignificant person was ever born.",5
2001-01-20,gwb,Americans are called to enact this promise in our lives and in our laws.,5
2001-01-20,gwb,"And though our Nation has sometimes halted and sometimes delayed, we must follow no other course.",3
2001-01-20,gwb,"Through much of the last century, America's faith in freedom and democracy was a rock in a raging sea.",5
2001-01-20,gwb,"Now it is a seed upon the wind, taking root in many nations.",4
2001-01-20,gwb,Our democratic faith is more than the creed of our country.,6
2001-01-20,gwb,"It is the inborn hope of our humanity, an ideal we carry but do not own, a trust we bear and pass along.",6
2001-01-20,gwb,"Even after nearly 225 years, we have a long way yet to travel.",4
2001-01-20,gwb,"While many of our citizens prosper, others doubt the promise, even the justice of our own country.",5
2001-01-20,gwb,The ambitions of some Americans are limited by failing schools and hidden prejudice and the circumstances of their birth.,5
2001-01-20,gwb,"And sometimes our differences run so deep, it seems we share a continent but not a country.",4
2001-01-20,gwb,"We do not accept this, and we will not allow it.",2
2001-01-20,gwb,"Our unity, our Union, is a serious work of leaders and citizens and every generation.",4
2001-01-20,gwb,And this is my solemn pledge: I will work to build a single nation of justice and opportunity.,5
2001-01-20,gwb,"I know this is in our reach because we are guided by a power larger than ourselves, who creates us equal, in His image, and we are confident in principles that unite and lead us onward.",8
2001-01-20,gwb,America has never been united by blood or birth or soil.,4
2001-01-20,gwb,"We are bound by ideals that move us beyond our backgrounds, lift us above our interests, and teach us what it means to be citizens.",6
2001-01-20,gwb,Every child must be taught these principles.,2
2001-01-20,gwb,Every citizen must uphold them.,2
2001-01-20,gwb,"And every immigrant, by embracing these ideals, makes our country more, not less, American.",5
2001-01-20,gwb,"Today we affirm a new commitment to live out our Nation's promise through civility, courage, compassion, and character.",7
2001-01-20,gwb,America at its best matches a commitment to principle with a concern for civility.,4
2001-01-20,gwb,"A civil society demands from each of us good will and respect, fair dealing and forgiveness.",4
2001-01-20,gwb,Some seem to believe that our politics can afford to be petty because in a time of peace the stakes of our debates appear small.,7
2001-01-20,gwb,But the stakes for America are never small.,3
2001-01-20,gwb,"If our country does not lead the cause of freedom, it will not be led.",4
2001-01-20,gwb,"If we do not turn the hearts of children toward knowledge and character, we will lose their gifts and undermine their idealism.",5
2001-01-20,gwb,"If we permit our economy to drift and decline, the vulnerable will suffer most.",3
2001-01-20,gwb,We must live up to the calling we share.,4
2001-01-20,gwb,"Civility is not a tactic or a sentiment; it is the determined choice of trust over cynicism, of community over chaos.",5
2001-01-20,gwb,"And this commitment, if we keep it, is a way to shared accomplishment.",4
2001-01-20,gwb,America at its best is also courageous.,4
2001-01-20,gwb,"Our national courage has been clear in times of depression and war, when defeating common dangers defined our common good.",5
2001-01-20,gwb,Now we must choose if the example of our fathers and mothers will inspire us or condemn us.,5
2001-01-20,gwb,We must show courage in a time of blessing by confronting problems instead of passing them on to future generations.,7
2001-01-20,gwb,Together we will reclaim America's schools before ignorance and apathy claim more young lives.,4
2001-01-20,gwb,"We will reform Social Security and Medicare, sparing our children from struggles we have the power to prevent.",5
2001-01-20,gwb,And we will reduce taxes to recover the momentum of our economy and reward the effort and enterprise of working Americans.,6
2001-01-20,gwb,"We will build our defenses beyond challenge, lest weakness invite challenge.",2
2001-01-20,gwb,"We will confront weapons of mass destruction, so that a new century is spared new horrors.",4
2001-01-20,gwb,"The enemies of liberty and our country should make no mistake: America remains engaged in the world, by history and by choice, shaping a balance of power that favors freedom.",4
2001-01-20,gwb,We will defend our allies and our interests.,3
2001-01-20,gwb,We will show purpose without arrogance.,2
2001-01-20,gwb,We will meet aggression and bad faith with resolve and strength.,4
2001-01-20,gwb,"And to all nations, we will speak for the values that gave our Nation birth.",5
2001-01-20,gwb,America at its best is compassionate.,4
2001-01-20,gwb,"In the quiet of American conscience, we know that deep, persistent poverty is unworthy of our Nation's promise.",6
2001-01-20,gwb,"And whatever our views of its cause, we can agree that children at risk are not at fault.",5
2001-01-20,gwb,Abandonment and abuse are not acts of God; they are failures of love.,4
2001-01-20,gwb,"And the proliferation of prisons, however necessary, is no substitute for hope and order in our souls.",4
2001-01-20,gwb,"Where there is suffering, there is duty.",3
2001-01-20,gwb,Americans in need are not strangers; they are citizens—not problems but priorities.,4
2001-01-20,gwb,And all of us are diminished when any are hopeless.,3
2001-01-20,gwb,"Government has great responsibilities for public safety and public health, for civil rights and common schools.",5
2001-01-20,gwb,"Yet, compassion is the work of a nation, not just a government.",4
2001-01-20,gwb,And some needs and hurts are so deep they will only respond to a mentor's touch or a pastor's prayer.,7
2001-01-20,gwb,"Church and charity, synagogue and mosque lend our communities their humanity, and they will have an honored place in our plans and in our laws.",6
2001-01-20,gwb,Many in our country do not know the pain of poverty.,4
2001-01-20,gwb,But we can listen to those who do.,4
2001-01-20,gwb,"And I can pledge our Nation to a goal: When we see that wounded traveler on the road to Jericho, we will not pass to the other side.",6
2001-01-20,gwb,America at its best is a place where personal responsibility is valued and expected.,4
2001-01-20,gwb,Encouraging responsibility is not a search for scapegoats; it is a call to conscience.,4
2001-01-20,gwb,"And though it requires sacrifice, it brings a deeper fulfillment.",2
2001-01-20,gwb,We find the fullness of life not only in options but in commitments.,4
2001-01-20,gwb,And we find that children and community are the commitments that set us free.,4
2001-01-20,gwb,"Our public interest depends on private character, on civic duty and family bonds and basic fairness, on uncounted, unhonored acts of decency, which give direction to our freedom.",6
2001-01-20,gwb,Sometimes in life we're called to do great things.,3
2001-01-20,gwb,"But as a saint of our times has said, ""Every day we are called to do small things with great love.""",5
2001-01-20,gwb,The most important tasks of a democracy are done by everyone.,4
2001-01-20,gwb,"I will live and lead by these principles: to advance my convictions with civility, to serve the public interest with courage, to speak for greater justice and compassion, to call for responsibility and try to live it, as well.",8
