"As I’ve said before, she made an appearance at the request of the White House in which she gave her best understanding of the intelligence that had been provided to her.  If Senator McCain and Senator Graham and others want to go after somebody, they should go after me.  And I’m happy to have that discussion with them.  But for them to go after the U.N. Ambassador, who had nothing to do with Benghazi, and was simply making a presentation based on intelligence that she had received, and to besmirch her reputation is outrageous. "
"And we’re after an election now.  I think it is important for us to find out exactly what happened in Benghazi, and I’m happy to cooperate in any ways that Congress wants.  We have provided every bit of information that we have, and we will continue to provide information.  And we’ve got a full-blown investigation, and all that information will be disgorged to Congress. "
"And I don't think there’s any debate in this country that when you have four Americans killed, that's a problem.  And we’ve got to get to the bottom of it, and there needs to be accountability.  We’ve got to bring those who carried it out to justice.  They won’t get any debate from me on that."
"But when they go after the U.N. Ambassador, apparently because they think she’s an easy target, then they’ve got a problem with me.  And should I choose, if I think that she would be the best person to serve America in the capacity of the State Department, then I will nominate her.  That's not a determination that I’ve made yet."
Ed Henry.
"Question:   I want to take Chuck’s lead and just ask a very small follow-up, which is whether you feel you have a mandate not just on taxes but on a range of issues because of your decisive victory? "
"But I want to stay on Benghazi, based on what Jon asked because you said, if they want to come after me, come after me.  I wanted to ask about the families of these four Americans who were killed.  Sean Smith’s father, Ray, said he believes his son basically called 911 for help and they didn't get it.  And I know you’ve said you grieve for these four Americans, that it’s being investigated, but the families have been waiting for more than two months.  So I would like to -- for you to address the families, if you can.  On 9/11, as Commander-in-Chief, did you issue any orders to try to protect their lives?"
"President Obama:  Ed, I’ll address the families not through the press.  I’ll address the families directly, as I already have.  And we will provide all the information that is available about what happened on that day.  That’s what the investigation is for. "
"But as I’ve said repeatedly, if people don’t think that we did everything we can to make sure that we saved the lives of folks who I sent there and who were carrying out missions on behalf of the United States, then you don’t know how our Defense Department thinks or our State Department thinks or our CIA thinks.  Their number-one priority is obviously to protect American lives.  That’s what our job is.  Now --"
Question:  [Inaudible.]
"President Obama:  Ed, I will put forward every bit of information that we have.  I can tell you that immediately upon finding out that our folks were in danger, that my orders to my national security team were do whatever we need to do to make sure they’re safe.  And that’s the same order that I would give any time that I see Americans are in danger, whether they’re civilian or military, because that’s our number-one priority."
"With respect to the issue of mandate, I’ve got one mandate. I’ve got a mandate to help middle-class families and families that are working hard to try to get into the middle class.  That’s my mandate.  That’s what the American people said.  They said:  Work really hard to help us.  Don’t worry about the politics of it; don’t worry about the party interests; don’t worry about the special interests.  Just work really hard to see if you can help us get ahead -- because we’re working really hard out here and we’re still struggling, a lot of us.  That’s my mandate."
"I don’t presume that because I won an election that everybody suddenly agrees with me on everything.  I’m more than familiar with all the literature about presidential overreach in second terms.  We are very cautious about that.  On the other hand, I didn’t get reelected just to bask in reelection.  I got elected to do work on behalf of American families and small businesses all across the country who are still recovering from a really bad recession, but are hopeful about the future. "
"And I am, too.  The one thing that I said during the campaign that maybe sounds like a bunch of campaign rhetoric, but now that the campaign is over I am going to repeat it and hopefully you guys will really believe me -- when you travel around the country, you are inspired by the grit and resilience and hard work and decency of the American people.  And it just makes you want to work harder.  You meet families who are -- have overcome really tough odds and somehow are making it and sending their kids to college.  And you meet young people who are doing incredible work in disadvantaged communities because they believe in the American ideal and it should available for everybody.  And you meet farmers who are helping each other during times of drought, and you meet businesses that kept their doors open during the recession, even though the owner didn’t have to take a salary. "
"And when you talk to these folks, you say to yourself, man, they deserve a better government than they've been getting.  They deserve all of us here in Washington to be thinking every single day, how can I make things a little better for them -- which isn't to say that everything we do is going to be perfect, or that there aren't just going to be some big, tough challenges that we have to grapple with.  But I do know the federal government can make a difference. "
"We're seeing it right now on the Jersey coast and in New York.  People are still going through a really tough time; the response hasn't been perfect; but it's been aggressive and strong and fast and robust, and a lot of people have been helped because of it.  And that’s a pretty good metaphor for how I want the federal government to operate generally, and I'm going to do everything I can to make sure it does."
Christi Parson.  Hey. 
"Question:  Thank you, Mr. President, and congratulations, by the way. "
President Obama:  Thanks. 
Question:  One quick follow up --
President Obama:  Christi was there when I was running for state Senate.
"Question:  That’s right, I was. "
President Obama:  So Christi and I go back a ways.
Question:  I've never seen you lose.  I wasn't looking that one time.
President Obama:  There you go.   
"Question:  One quick follow-up, and then I want to ask you about Iran.  I just want to make sure I understood what you said.  Can you envision any scenario in which we do go off the fiscal cliff at the end of the year? "
"And on Iran, are you preparing a final diplomatic push here to resolve the nuclear program issue, and are we headed toward one-on-one talks?"
"President Obama:  Well, obviously, we can all imagine a scenario where we go off the fiscal cliff.  If despite the election, if despite the dangers of going over the fiscal cliff and what that means for our economy, that there’s too much stubbornness in Congress that we can't even agree on giving middle-class families a tax cut, then middle-class families are all going to end up having a big tax hike.  And that’s going to be a pretty rude shock for them, and I suspect will have a big impact on the holiday shopping season, which, in turn, will have an impact on business planning and hiring, and we can go back into a recession. "
"It would be a bad thing.  It is not necessary.  So I want to repeat:  Step number one that we can take in the next couple of weeks, provide certainty to middle-class families -- 98 percent of families who make less than $250,000 a year, 97 percent of small businesses -- that their taxes will not go up a single dime next year.  Give them that certainty right now.  We can get that done. "
"We can then set up a structure whereby we are dealing with tax reform, closing deductions, closing loopholes, simplifying, dealing with entitlements.  And I’m ready and willing to make big commitments to make sure that we’re locking in the kind of deficit reductions that stabilize our deficit, start bringing it down, start bringing down our debt.  I’m confident we can do it."
"And, look, I’ve been living with this for a couple of years now.  I know the math pretty well.  And it really is arithmetic; it’s not calculus.  There are some tough things that have to be done, but there is a way of doing this that does not hurt middle-class families, that does not hurt our seniors, doesn’t hurt families with disabled kids, allows us to continue to invest in those things that make us grow, like basic research and education, helping young people afford going to college.  As we’ve already heard from some Republican commentators, a modest tax increase on the wealthy is not going to break their backs; they’ll still be wealthy.  And it will not impinge on business investment. "
"So we know how to do this.  This is just a matter of whether or not we come together and go ahead and say, Democrats and Republicans, we’re both going to hold hands and do what’s right for the American people.  And I hope that’s what happens."
"With respect to Iran, I very much want to see a diplomatic resolution to the problem.  I was very clear before the campaign, I was clear during the campaign, and I’m now clear after the campaign -- we’re not going to let Iran get a nuclear weapon.  But I think there is still a window of time for us to resolve this diplomatically.  We’ve imposed the toughest sanctions in history.  It is having an impact on Iran’s economy. "
There should be a way in which they can enjoy peaceful nuclear power while still meeting their international obligations and providing clear assurances to the international community that they’re not pursuing a nuclear weapon. 
"And so, yes, I will try to make a push in the coming months to see if we can open up a dialogue between Iran and not just us, but the international community, to see if we can get this things resolved.  I can’t promise that Iran will walk through the door that they need to walk through, but that would be very much the preferable option."
Question:  And under what circumstances would one-on-one conversations take place?
"President Obama:  I won’t talk about the details in negotiations.  But I think it’s fair to say we want to get this resolved, and we’re not going to be constrained by diplomatic niceties or protocols.  If Iran is serious about wanting to resolve this, they’ll be in a position to resolve it."
Question:  At one point just prior to the election that was talk that talks might be imminent.  
"President Obama:  That was not true, and it’s not true as of today."
Just going to knock through a couple others.  Mark Landler.  Where’s Mark?  There he is right in front of me.
"Question:  Thank you, Mr. President.  In his endorsement of you a few weeks ago, Mayor Bloomberg said he was motivated by the belief that you would do more to confront the threat of climate change than your opponent.  Tomorrow you’re going up to New York City where you’re going to, I assume, see people who are still suffering the effects of Hurricane Sandy, which many people say is further evidence of how a warming globe is changing our weather.  What specifically do you plan to do in a second term to tackle the issue of climate change?  And do you think the political will exists in Washington to pass legislation that could include some kind of attacks on carbon? "
"President Obama:  As you know, Mark, we can’t attribute any particular weather event to climate change.  What we do know is the temperature around the globe is increasing faster than was predicted even 10 years ago.  We do know that the Arctic ice cap is melting faster than was predicted even five years ago.  We do know that there have been extraordinarily -- there have been an extraordinarily large number of severe weather events here in North America, but also around the globe."
"And I am a firm believer that climate change is real, that it is impacted by human behavior and carbon emissions.  And as a consequence, I think we've got an obligation to future generations to do something about it."
"Now, in my first term, we doubled fuel efficiency standards on cars and trucks.  That will have an impact.  That will take a lot of carbon out of the atmosphere.  We doubled the production of clean energy, which promises to reduce the utilization of fossil fuels for power generation.  And we continue to invest in potential breakthrough technologies that could further remove carbon from our atmosphere.  But we haven't done as much as we need to."
"So what I'm going to be doing over the next several weeks, next several months, is having a conversation, a wide-ranging conversation with scientists, engineers, and elected officials to find out what can -- what more can we do to make a short-term progress in reducing carbons, and then working through an education process that I think is necessary -- a discussion, a conversation across the country about what realistically can we do long term to make sure that this is not something we're passing on to future generations that's going to be very expensive and very painful to deal with."
"I don't know what either Democrats or Republicans are prepared to do at this point, because this is one of those issues that's not just a partisan issue; I also think there are regional differences.  There’s no doubt that for us to take on climate change in a serious way would involve making some tough political choices.  And understandably, I think the American people right now have been so focused, and will continue to be focused on our economy and jobs and growth, that if the message is somehow we're going to ignore jobs and growth simply to address climate change, I don't think anybody is going to go for that.  I won't go for that."
"If, on the other hand, we can shape an agenda that says we can create jobs, advance growth, and make a serious dent in climate change and be an international leader, I think that's something that the American people would support."
So you can expect that you’ll hear more from me in the coming months and years about how we can shape an agenda that garners bipartisan support and helps move this agenda forward.
"Question:  Sounds like you're saying, though, in the current environment, we're probably still short of a consensus on some kind of attack."
"President Obama:  That I'm pretty certain of.  And, look, we're still trying to debate whether we can just make sure that middle-class families don't get a tax hike.  Let’s see if we can resolve that.  That should be easy.  This one is hard -- but it’s important because one of the things that we don't always factor in are the costs involved in these natural disasters; we just put them off as something that's unconnected to our behavior right now.  And I think what -- based on the evidence we're seeing, is that what we do now is going to have an impact and a cost down the road if we don’t do something about it."
"All right, last question.  Mark Felsenthal.  Where’s Mark?"
"Question:  Thank you.  Mr. President, the Assad regime is engaged in a brutal crackdown on its people.  France has recognized the opposition coalition.  What would it take for the United States to do the same?  And is there any point at which the United States would consider arming the rebels?"
"President Obama:  I was one of the first leaders I think around the world to say Assad had to go, in response to the incredible brutality that his government displayed in the face of what were initially peaceful protests."
"Obviously, the situation in Syria has deteriorated since then.  We have been extensively engaged with the international community as well as regional powers to help the opposition.  We have committed to hundreds of millions of dollars of humanitarian aid to help folks both inside of Syria and outside of Syria.  We are constantly consulting with the opposition on how they can get organized so that they’re not splintered and divided in the face of the onslaught from the Assad regime. "
"We are in very close contact with countries like Turkey and Jordan that immediately border Syria and have an impact -- and obviously Israel, which is having already grave concerns, as we do, about, for example, movements of chemical weapons that might occur in such a chaotic atmosphere and that could have an impact not just within Syria, but on the region as a whole."
I’m encouraged to see that the Syrian opposition created an umbrella group that may have more cohesion than they’ve had in the past.  We’re going to be talking to them.  My envoys are going to be traveling to various meetings that are going to be taking place with the international community and the opposition.
"We consider them a legitimate representative of the aspirations of the Syrian people.  We’re not yet prepared to recognize them as some sort of government in exile, but we do think that it is a broad-based representative group.  One of the questions that we’re going to continue to press is making sure that that opposition is committed to a democratic Syria, an inclusive Syria, a moderate Syria."
"We have seen extremist elements insinuate themselves into the opposition, and one of the things that we have to be on guard about -- particularly when we start talking about arming opposition figures -- is that we’re not indirectly putting arms in the hands of folks who would do Americans harm, or do Israelis harm, or otherwise engage in actions that are detrimental to our national security."
"So we're constantly probing and working on that issue.  The more engaged we are, the more we'll be in a position to make sure that we are encouraging the most moderate, thoughtful elements of the opposition that are committed to inclusion, observance of human rights, and working cooperatively with us over the long term."
Thank you very much.
"Question:  -- spending side of the fiscal cliff.  On spending, the $1.2 trillion trigger, is that something that you can see having a short-term component -- because I remember you said it's not happening -- "
"President Obama:  That was a great question, but it would be a horrible precedent for me to answer your question just because you yelled it out."
"So thank you very much, guys."
