"Now, so you’ve got a good job; you get a good education -- those have always been the key stepping stones into the middle class.  But a home of your own has always been the clearest expression of middle-class security.  For most families, that’s your biggest asset.  For most families, that’s where your life’s work has been invested.  And that changed during the crisis, when we saw millions of middle-class families experience their home values plummeting.  The good news is over the past four years, we’ve helped more responsible homeowners stay in their homes.  And today, sales are up and prices are up, and fewer Americans see their homes underwater. But we’re not done yet.  The key now is to encourage homeownership that isn’t based on unrealistic bubbles, but instead is based on a solid foundation, where buyers and lenders play by the same set of rules, rules that are clear and transparent and fair.  So already, I’ve asked Congress to pass a really good, bipartisan idea -- one that was championed, by the way, by Mitt Romney’s economic advisor -- and this is the idea to give every homeowner the chance to refinance their mortgage while rates are still low so they can save thousands of dollars a year.  It will be like a tax cut for families who can refinance.  I’m also acting on my own to cut red tape for responsible families who want to get a mortgage but the bank is saying no.  We’ll work with both parties to turn the page on Fannie Mae and Freddie Mac, and build a housing finance system that’s rock-solid for future generations. So we’ve got more work to do to strengthen homeownership in this country.  But along with homeownership, the fourth cornerstone of what it means to be middle class in this country is a secure retirement.  I hear from too many people across the country, face to face or in letters that they send me, that they feel as if retirement is just receding from their grasp.  It’s getting farther and farther away.  They can't see it.  Now, today, a rising stock market has millions of retirement balances going up, and some of the losses that had taken place during the financial crisis have been recovered.  But we still live with an upside-down system where those at the top, folks like me, get generous tax incentives to save, while tens of millions of hardworking Americans who are struggling, they get none of those breaks at all.  So as we work to reform our tax code, we should find new ways to make it easier for workers to put away money, and free middle-class families from the fear that they won't be able to retire."
"And if Congress is looking for a bipartisan place to get started, I should just say they don’t have to look far.  We mentioned immigration reform before.  Economists show that immigration reform makes undocumented workers pay their full share of taxes, and that actually shores up the Social Security system for years.  So we should get that done. Good job; good education for your kids; home of your own; secure retirement.  Fifth, I'm going to keep focusing on health care --  because middle-class families and small business owners deserve the security of knowing that neither an accident or an illness is going to threaten the dreams that you’ve worked a lifetime to build.  As we speak, we're well on our way to fully implementing the Affordable Care Act.  We're going to implement it.  Now, if you’re one of the 85 percent of Americans who already have health insurance either through the job or Medicare or Medicaid, you don’t have to do anything, but you do have new benefits and better protections than you did before.  You may not know it, but you do.  Free checkups, mammograms, discounted medicines if you're on Medicare -- that’s what the Affordable Care Act means.  You're already getting a better deal.  No lifetime limits. If you don’t have health insurance, then starting on October 1st, private plans will actually compete for your business, and you'll be able to comparison-shop online.  There will be a marketplace online, just like you’d buy a flat-screen TV or plane tickets or anything else you're doing online, and you'll be able to buy an insurance package that fits your budget and is right for you.  And if you're one of the up to half of all Americans who’ve been sick or have a preexisting condition -- if you look at this auditorium, about half of you probably have a preexisting condition that insurance companies could use to not give you insurance if you lost your job or lost your insurance -- well, this law means that beginning January 1st, insurance companies will finally have to cover you and charge you the same rates as everybody else, even if you have a preexisting condition.  That’s what the Affordable Care Act does.  That’s what it does."
"Now, look, I know because I've been living it that there are folks out there who are actively working to make this law fail.  And I don’t always understand exactly what their logic is here, why they think giving insurance to folks who don’t have it and making folks with insurance a little more secure, why they think that’s a bad thing.  But despite the politically motivated misinformation campaign, the states that have committed themselves to making this law work are finding that competition and choice are actually pushing costs down. So just last week, New York announced that premiums for consumers who buy their insurance in these online marketplaces will be at least 50 percent lower than what they're paying today -- 50 percent lower.  So folks' premiums in the individual market will drop by 50 percent.  And for them and for the millions of Americans who’ve been able to cover their sick kids for the first time -- like this gentlemen who just said his daughter has got health insurance -- or have been able to cover their employees more cheaply, or are able to have their kids who are younger than -- who are 25 or 26 stay on their parents' plan -- for all those folks, you'll have the security of knowing that everything you’ve worked hard for is no longer one illness away from being wiped out."
"Finally, as we work to strengthen these cornerstones of middle-class security -- good job with decent wages and benefits, a good education, home of your own, retirement security, health care security -- I’m going to make the case for why we've got to rebuild ladders of opportunity for all those Americans who haven't quite made it yet -- who are working hard but are still suffering poverty wages, who are struggling to get full-time work."
"There are a lot of folks who are still struggling out here, too many people in poverty.  Here in America, we’ve never guaranteed success -- that's not what we do.  More than some other countries, we expect people to be self-reliant.  Nobody is going to do something for you.  We've tolerated a little more inequality for the sake of a more dynamic, more adaptable economy.  That's all for the good.  But that idea has always been combined with a commitment to equality of opportunity to upward mobility -- the idea that no matter how poor you started, if you're willing to work hard and discipline yourself and defer gratification, you can make it, too.  That's the American idea."
"Unfortunately, opportunities for upward mobility in America have gotten harder to find over the past 30 years.  And that’s a betrayal of the American idea.  And that’s why we have to do a lot more to give every American the chance to work their way into the middle class. The best defense against all of these forces -- global competition, economic polarization -- is the strength of the community.  So we need a new push to rebuild rundown neighborhoods.  We need new partnerships with some of the hardest-hit towns in America to get them back on their feet.  And because no one who works full-time in America should have to live in poverty, I am going to keep making the case that we need to raise the minimum wage -- because it's lower right now than it was when Ronald Reagan took office.  It's time for the minimum wage to go up."
"We're not a people who allow chance of birth to decide life’s biggest winners or losers.  And after years in which we’ve seen how easy it can be for any of us to fall on hard times -- folks in Galesburg, folks in the Quad Cities, you know there are good people who work hard and sometimes they get a bad break.  A plant leaves.  Somebody gets sick.  Somebody loses a home.  We've seen it in our family, in our friends and our neighbors.  We've seen it happen.  And that means we cannot turn our backs when bad breaks hit any of our fellow citizens. So good jobs; a better bargain for the middle class and the folks who are working to get into the middle class; an economy that grows from the middle out, not the top down -- that's where I will focus my energies.  That's where I will focus my energies not just for the next few months, but for the remainder of my presidency.  These are the plans that I'll lay out across this country.  But I won’t be able to do it alone, so I'm going to be calling on all of us to take up this cause.  We’ll need our businesses, who are some of the best in the world, to pressure Congress to invest in our future.  And I’ll be asking our businesses to set an example by providing decent wages and salaries to their own employees.  And I’m going to highlight the ones that do just that.  There are companies like Costco, which pays good wages and offers good benefits.  Companies like -- there are companies like the Container Store, that prides itself on training its employees and on employee satisfaction -- because these companies prove that it’s not just good for the employees, it’s good for their businesses to treat workers well.  It’s good for America."
So I’m going to be calling on the private sector to step up. I will be saying to Democrats we’ve got to question some of our old assumptions.  We’ve got to be willing to redesign or get rid of programs that don't work as well as they should.  We’ve got to be willing to -- we’ve got to embrace changes to cherished priorities so that they work better in this new age.  We can't just -- Democrats can't just stand pat and just defend whatever government is doing.  If we believe that government can give the middle class a fair shot in this new century -- and I believe that -- we’ve an obligation to prove it.  And that means that we’ve got to be open to new ways of doing things. And we’ll need Republicans in Congress to set aside short-term politics and work with me to find common ground.
"It’s interesting, in the run-up to this speech, a lot of reporters say that, well, Mr. President, these are all good ideas, but some of you’ve said before; some of them sound great, but you can't get those through Congress.  Republicans won’t agree with you.  And I say, look, the fact is there are Republicans in Congress right now who privately agree with me on a lot of the ideas I’ll be proposing.  I know because they’ve said so.  But they worry they’ll face swift political retaliation for cooperating with me. Now, there are others who will dismiss every idea I put forward either because they’re playing to their most strident supporters, or in some cases because, sincerely, they have a fundamentally different vision for America -- one that says inequality is both inevitable and just; one that says an unfettered free market without any restraints inevitably produces the best outcomes, regardless of the pain and uncertainty imposed on ordinary families; and government is the problem and we should just shrink it as small as we can. In either case, I say to these members of Congress:  I’m laying out my ideas to give the middle class a better shot.  So now it’s time for you to lay out your ideas.  You can't just be against something.  You got to be for something."
"Even if you think I’ve done everything wrong, the trends I just talked about were happening well before I took office.  So it’s not enough for you just to oppose me.  You got to be for something.  What are your ideas?  If you’re willing to work with me to strengthen American manufacturing and rebuild this country’s infrastructure, let’s go.  If you’ve got better ideas to bring down the cost of college for working families, let’s hear them.  If you think you have a better plan for making sure that every American has the security of quality, affordable health care, then stop taking meaningless repeal votes, and share your concrete ideas with the country."
"Repealing Obamacare and cutting spending is not an economic plan.  It’s not. If you’re serious about a balanced, long-term fiscal plan that replaces the mindless cuts currently in place, or if you’re interested in tax reform that closes corporate loopholes and gives working families a better deal, I’m ready to work.  But you should know that I will not accept deals that don’t meet the basic test of strengthening the prospects of hardworking families.  This is the agenda we have to be working on."
"We’ve come a long way since I first took office.   As a country, we’re older and wiser.  I don’t know if I’m wiser, but I’m certainly older.  And as long as Congress doesn’t manufacture another crisis -- as long as we don’t shut down the government just because I’m for keeping it open -- as long as we don’t risk a U.S. default over paying bills that we’ve already racked up, something that we’ve never done -- we can probably muddle along without taking bold action.  If we stand pat and we don’t do any of the things I talked about, our economy will grow, although slower than it should.  New businesses will form.  The unemployment rate will probably tick down a little bit.  Just by virtue of our size and our natural resources and, most of all, because of the talent of our people, America will remain a world power, and the majority of us will figure out how to get by. But you know what, that’s our choice.  If we just stand by and do nothing in the face of immense change, understand that part of our character will be lost.  Our founding precepts about wide-open opportunity, each generation doing better than the last -- that will be a myth, not reality.  The position of the middle class will erode further.  Inequality will continue to increase. Money’s power will distort our politics even more.  Social tensions will rise, as various groups fight to hold on to what they have, or start blaming somebody else for why their position isn’t improving.  And the fundamental optimism that’s always propelled us forward will give way to cynicism or nostalgia. And that’s not the vision I have for this country.  It’s not the vision you have for this country.  That’s not the America we know.  That’s not the vision we should be settling for.  That’s not a vision we should be passing on to our children.  I have now run my last campaign.  I do not intend to wait until the next campaign or the next President before tackling the issues that matter.  I care about one thing and one thing only, and that’s how to use every minute -- the only thing I care about is how to use every minute of the remaining 1,276 days of my term -- to make this country work for working Americans again.  That’s all I care about.  I don’t have another election."
"Because I’ll tell you, Galesburg, that’s where I believe America needs to go.  I believe that’s where the American people want to go.  And it may seem hard today, but if we’re willing to take a few bold steps -- if Washington will just shake off its complacency and set aside the kind of slash-and-burn partisanship that we’ve just seen for way too long -- if we just make some common-sense decisions, our economy will be stronger a year from now.  It will be stronger five years from now.  It will be stronger 10 years from now."
"If we focus on what matters, then more Americans will know the pride of that first paycheck.  More Americans will have the satisfaction of flipping the sign to “Open” on their own business.  More Americans will have the joy of scratching the height of their kid on that door of their brand-new home."
"And in the end, isn't that what makes us special?  It's not the ability to generate incredible wealth for the few; it's our ability to give everybody a chance to pursue their own true measure of happiness.  We haven’t just wanted success for ourselves -- we want it for our neighbors, too."
"When we think about our own communities -- we're not a mean people; we're not a selfish people; we're not a people that just looks out for “number one.”  Why should our politics reflect those kinds of values?  That’s why we don’t call it John’s dream or Susie’s dream or Barack’s dream or Pat's dream -- we call it the American Dream.  And that’s what makes this country special  -- the idea that no matter who you are or what you look like or where you come from or who you love, you can make it if you try.  That’s what we're fighting for."
"So, yes, Congress is tough right now, but that’s not going to stop me.  We're going to do everything we can, wherever we can, with or without Congress, to make things happen.  We're going to go on the road and talk to you, and you'll have ideas, and we want to see which ones we can implement.  But we're going to focus on this thing that matters. One of America’s greatest writers, Carl Sandburg, born right here in Galesburg over a century ago -- he saw the railroads bring the world to the prairie, and then the prairie sent out its bounty to the world.  And he saw the advent of new industries, new technologies, and he watched populations shift.  He saw fortunes made and lost.  And he saw how change could be painful -- how a new age could unsettle long-held customs and ways of life.  But he had that frontier optimism, and so he saw something more on the horizon.  And he wrote, “I speak of new cities and new people.  The past is a bucket of ashes.  Yesterday is a wind gone down, a sun dropped in the west.  There is only an ocean of tomorrows, a sky of tomorrows.” Well, America, we’ve made it through the worst of yesterday’s winds.  We just have to have the courage to keep moving forward.  We've got to set our eyes on the horizon.  We will find an ocean of tomorrows.  We will find a sky of tomorrows for the American people and for this great country that we love. So thank you.  God bless you.  And God bless the United States of America."
