"Good afternoon, everybody.  Have a seat."
"Question:  Thank you, Mr. President.  Another deadline coming up is your negotiators by November 24th have to figure out if they’re going to reach a deal with Iran on a nuclear area, a nuclear agreement.  I’m interested what your current perspective is on how those negotiations are going.  Also if it is your feeling that you have the power to implement any type of agreement that's reached without any action from Congress?  And then, also I just wanted to quickly touch on the AUMF that you mentioned earlier.  Is that going to be more of a codification of the limits that you've put in place for the mission up to this point?  Or what should we be looking for on that when you send it to the Hill?  Thank you."
"President Obama:  On the AUMF, the leaders are going to be coming here on Friday.  It will be an expanded group, not just the four leaders, but a larger group who all have an interest in the issues we're discussing today.  And I’m actually going to invite Lloyd Austin, the CENTCOM Commander, to make a presentation about how our fight against ISIL is proceeding and I think to answer questions and assure that Congress is fully briefed on what we're doing there."
"With respect to the AUMF, we’ve already had conversations with members of both parties in Congress, and the idea is to right-size and update whatever authorization Congress provides to suit the current fight, rather than previous fights. "
"In 2001, after the heartbreaking tragedy of 9/11, we had a very specific set of missions that we had to conduct, and the AUMF was designed to pursue those missions.  With respect to Iraq, there was a very specific AUMF."
"We now have a different type of enemy.  The strategy is different.  How we partner with Iraq and other Gulf countries and the international coalition -- that has to be structured differently.  So it makes sense for us to make sure that the authorization from Congress reflects what we perceive to be not just our strategy over the next two or three months, but our strategy going forward."
"And it will be a process of listening to members of Congress, as well as us presenting what we think needs to be the set of authorities that we have.  And I’m confident we're going to be able to get that done.  And that may just be a process of us getting it started now.  It may carry over into the next Congress."
"On Iran, because of the unprecedented sanctions that we put in place that really did have a crippling effect on Iran’s economy, they’ve come to the table and they’ve negotiated seriously around providing assurances that they're not developing a nuclear weapon for the first time.  And they have abided by the interim rules.  We have been able to freeze their program, in some cases reduce the stockpile of nuclear material that they already had in hand.  And the discussions, the negotiations have been constructive. "
"The international community has been unified and cohesive.  There haven’t been a lot of cracks in our alliance.  Even countries where we have some differences, like Russia, have agreed with us and have worked with us cooperatively in trying to find ways to make sure that we can verify and have confidence going forward that Iran doesn't have the capacity to develop a nuclear weapon that could not only threaten friends of ours like Israel, trigger a nuclear arms race in the region, but could over the long term, potentially threaten us."
"Whether we can actually get a deal done, we’re going to have to find out over the next three to four weeks.  We have presented to them a framework that would allow them to meet their peaceful energy needs.  And if, in fact, what their leadership says, that they don’t want to develop a nuclear a weapon -- if that is, in fact, true, then they’ve got an avenue here to provide that assurance to the world community, and in a progressive, step-by-step, verifiable way, allow them to get out from under sanctions so that they can reenter as full-fledged members of the international community."
"But they have their own politics, and there’s a long tradition of mistrust between the two countries.  And there’s a sizeable portion of the political elite that cut its teeth on anti-Americanism and still finds it convenient to blame America for every ill that there is.  And whether they can manage to say yes to what clearly would be better for Iran, better for the region, and better for the world, is an open question.  We’ll find out over the next several weeks."
"Question:  Sir, on whether or not you have the power unilaterally to relax sanctions to implement an agreement?"
"President Obama:  There are a series of different sanctions.  There are multilateral sanctions; there are U.N. sanctions;  there are sanctions that have been imposed by us, this administration, unilaterally.  And I think it’s different for each of those areas."
"But I don’t want to put the cart before the horse.  What I want to do is see if we, in fact, have a deal.  If we do have a deal that I have confidence will prevent Iran from getting a nuclear weapon, and that we can convince the world and the public will prevent Iran from getting a nuclear weapon, then it will be time to engage in Congress.  And I think that we’ll be able to make a strong argument to Congress that this is the best way for us to avoid a nuclear Iran; that it will be more effective than any other alternatives we might take, including military action."
But that requires it being a good deal.  And I’ve said consistently that I’d rather have no deal than a bad deal -- because what we don’t want to do is lift sanctions and provide Iran legitimacy but not have the verifiable mechanisms to make sure that they don’t break out and produce a nuclear weapon.
Ed Henry.  I missed you guys.  I haven't done this in a while.
"Question:  I know, I’ve missed you.  Thank you, Mr. President.  I haven't heard you say a specific thing during this news conference that you would do differently.  You’ve been asked it a few different ways.  I understand you’re going to reach out, but you’ve talked about doing that before.  It’s almost like you’re doubling down on the same policies and approach you’ve had for six years.  So my question is, why not pull a page from the Clinton playbook and admit you have to make a much more dramatic shift in course for these last two years?"
"And on ISIS, there was pretty dramatic setback in the last few days with it appearing that the Syrian rebels have been routed.  There are some Gitmo detainees who have rejoined the battlefield, helping ISIS and other terror groups, is what the reports are suggesting.  So my question is, are we winning?"
"President Obama:  Well, I think it’s too early to say whether we are winning, because as I said at the outset of the ISIL campaign, this is going to be a long-term plan to solidify the Iraqi government, to solidify their security forces, to make sure that in addition to air cover that they have the capacity to run a ground game that pushes ISIL back from some of the territories that they had taken, that we have a strong international coalition that we’ve now built, but that they are on the ground providing the training, providing the equipment, providing the supplies that are necessary for Iraqis to fight on behalf of their territory."
"And what I also said was that in Syria that’s been complicated and that’s not going to be solved any time soon.  Our focus in Syria is not to solve the entire Syria situation, but rather to isolate the areas in which ISIL can operate.  And there is no doubt that because of the extraordinary bravery of our men and women in uniform, and the precision of our pilots and the strikes that have taken place, that ISIL is in a more vulnerable position and it is more difficult for them to maneuver than it was previously. "
"Now, there’s a specific issue about trying to get a moderate opposition in Syria that can serve as a partner with us on the ground.  That’s always been the hardest piece of business to get done.  There are a lot of opposition groups in Syria along a spectrum from radical jihadists who are our enemies to folks who believe in inclusive democracy, and everything in between.  They fight among each other.  They are fighting the regime. "
"And what we’re trying to do is to find a core group that we can work with that we have confidence in, that we’ve vetted, that can help in regaining territory from ISIL, and then ultimately serve as a responsible party to sit at the table in eventual political negotiations that are probably some ways off in the future. "
"That’s always been difficult.  As you know, one of the debates has consistently been, should the Obama administration provide more support to the opposition?  Could that have averted some of the problems that are taking place in Syria?  And as I’ve said before, part of the challenge is it’s a messy situation.  This is not a situation where we have one single unified, broad-based, effective, reliable --"
Question:  -- the idea that maybe we have to have --
"President Obama:  Let me answer the question, Ed.  And so what we are going to continue to test is, can we get a more stable, effective, cohesive, moderate opposition? "
"But that’s not the sole measure of whether we are “winning” or not.  Remember, our first focus, Ed, here is to drive ISIL out of Iraq.  And what we’re doing in Syria is, first and foremost, in service of reducing ISIL’s capacity to resupply and send troops, and then run back over the Syrian border -- to eventually reestablish a border between Iraq and Syria so that slowly Iraq regains control of its security and its territory.  That is our number-one mission.  That is our number-one focus. "
"There are aspects of what’s going on in Syria that we’ve got to deal with in order to reduce the scope of ISIL’s operations.  So, for example, our support for Kurds in Kobani, where they’ve been able to hold off ISIL and where we’ve been able to effectively strike ISIL positions consistently -- that’s not just because we’re trying to solve a Syria problem.  That’s also because it gives us an opportunity to further weaken ISIL so that we can meet our number-one mission, which is Iraq. "
"In terms of things to do differently, I guess, Ed, the question you’re asking is one actually I think I have answered.  If you’re asking about personnel, or if you’re asking about position on issues, or what have you, then it’s probably premature because I want to hear what --"
Question:  Your leadership.  Is there something about your leadership --
"President Obama:  Ed, what I’d like to do is to hear from the Republicans to find out what it is that they would like to see happen.  And what I’m committing to is making sure that I am open to working with them on the issues where they think that there’s going to be cooperation."
"Now, that isn’t a change, because I’ve suggested to them before that where they think there’s areas of cooperation, I’d like to see us get some things done.  But the fact that they now control both chambers of Congress I think means that perhaps they have more confidence that they can pass their agenda and get a bill on my desk.  It means that negotiations end up perhaps being a little more real because they have larger majorities, for example, in the House and they may be able to get some things through their caucuses that they couldn’t before."
"But the bottom line that the American people want to know and that I’m going to repeat here today is that my number-one goal -- because I’m not running again, I’m not on the ballot, I don’t have any further political aspirations -- my number-one goal is just to deliver as much as I can for the American people in these last two years.  And wherever I see an opportunity, no matter how large or how small, to make it a little bit easier for a kid to go to college, make it a little more likely that somebody is finding a good-paying job, make it a little more likely that somebody has high-quality health care -- even if I’m not getting a whole loaf, I’m interested in getting whatever legislation we can get passed that adds up to improved prospects and an improved future for the American people."
Sam Stein.
"Question:  Thank you, Mr. President.  Following the elections, congressional Republicans are pushing once again for major reforms to your health care act.  In the past, you’ve said you’re open to good ideas but you don’t want to undermine the bill.  Can you tell us what specific ideas you’re ruling out?  Have the election results changed your calculus on reforming the law?  And how confident are you heading into the second enrollment period? And on a totally unrelated matter -- have you settled on a nominee to replace Attorney General Eric Holder, and if so, who is it?"
"President Obama:  You guys want to spread out your news a little bit, don’t you?  You don’t want it all in just one big bang. "
"On the attorney general, we have a number of outstanding candidates who we’re taking a look at now, and in due course I will have an announcement.  And you’ll be there, Sam, when that’s announced.  But I’m confident that we’ll find somebody who is well-qualified, will elicit the confidence of the American people, will uphold their constitutional obligations and rule of law, and will get confirmed by the Senate."
"On health care, there are certainly some lines I’m going to draw.  Repeal of the law I won’t sign.  Efforts that would take away health care from the 10 million people who now have it and the millions more who are eligible to get it we're not going to support.  In some cases there may be recommendations that Republicans have for changes that would undermine the structure of the law, and I’ll be very honest with them about that and say, look, the law doesn't work if you pull out that piece or that piece."
"On the other hand, what I have said is there’s no law that's ever been passed that is perfect.  And given the contentious nature in which it was passed in the first place, there are places where, if I were just drafting a bill on our own, we would have made those changes back then, and certainly as we’ve been implementing, there are some other areas where we think we can do even better."
"So if, in fact, one of the items on Mitch McConnell’s agenda and John Boehner’s agenda is to make responsible changes to the Affordable Care Act to make it work better, I’m going to be very open and receptive to hearing those ideas.  But what I will remind them is that despite all the contention, we now know that the law works.  You've got millions of people who have health insurance who didn't have it before.  You've got states that have expanded Medicaid to folks who did not have it before, including Republican governors who’ve concluded this is a good deal for their state."
"And despite some of the previous predictions, even as we’ve enrolled more people into the Affordable Care Act and given more people the security of health insurance, health care inflation has gone done every single year since the law passed, so that we now have the lowest increase in health care costs in 50 years, which is saving us about $180 billion in reduced overall costs to the federal government in the Medicare program."
So we are I think really proud of the work that's been done. But there’s no doubt that there are areas where we can improve it.  So I’ll look forward to see what list they’ve got of improvements.
Question:  Is the individual mandate one of those lines you can't cross?
"President Obama:  The individual mandate is a line I can't cross because the concept, borrowed from Massachusetts, from a law instituted by a former opponent of mine, Mitt Romney, understood that if you're providing health insurance to people through the private marketplace, then you've got to make sure that people can't game the system and just wait until they get sick before they go try to buy health insurance.  You can't ensure that people with preexisting conditions can get health insurance unless you also say, while you're healthy, before you need it, you've got to get health insurance. "
"And obviously, there are hardship exemptions.  We understand that there are some folks who, even with the generous subsidies that have been provided, still can't afford it.  But that's a central component of the law."
"In terms of enrollment, we’ll do some additional announcements about that in the days to come.  Starting in the middle of this month, people can sign up again.  I think there are a number of people who the first time around sat on the sidelines in part because of our screw-ups on healthcare.gov."
"That's one area, Ed, by the way, that's very particular.  We're really making sure the website works super well before the next open enrollment period.  We're double and triple-checking it.  And so I think a lot of people who maybe initially thought we're not sure how this works, let’s wait and see -- they're going to have an opportunity now to sign up.  And what’s been terrific is to see how more private insurers have come into the marketplace so that there’s greater competition in more markets all around the country.  The premiums that have come in that are available to people and the choices that are available are better than a lot of people I think had predicted. "
So the law is working.  That doesn’t mean it can’t be improved.
Major Garrett.
"Question:  Thank you, Mr. President.  And if you do miss us, allow me to humbly suggest we do this every week."
President Obama:  We might.  Who knows.  I’m having a great time.
"Question:  Let me go back to immigration.  Moments before you walked out here, sir, Mitch McConnell said -- and I quote -- that if you in fact use your executive authority to legalize a certain number of millions of undocumented workers, it would “poison the well” -- direct quote -- and it would be “like waving a red flag in front of a bull.”  Do you not believe that is the considered opinion of the new Republican majority in the House and Senate?  And do you also not believe what they have said in the aftermath of last night’s results that the verdict rendered by voters should stop you or should prevent you from taking this action because it was a subtext in many of the campaigns?  Let me ask you a couple of specifics.  Republicans haven’t made a mystery about some of the things they intend to say --"
President Obama:  Do I have to write all of these down?
Question:  You’re very well familiar with these.  These will not be mysteries to you.
"President Obama:  No, but I --"
"Question:  Keystone XL pipeline -- they will send you legislation on that.  They will ask you to repeal the medical device tax as a part of a funding mechanism of the Affordable Care Act.  And they have said they would like to repatriate some maybe $2 trillion of offshore revenue at the corporate level by reforming the corporate tax code without touching the individual tax code.  To use your words, Mr. President, are any of those three lines you cannot cross and also deal with what you perceive to be Republican attitudes about immigration?"
"President Obama:  All right.  I think, Major, that I answered the question on immigration.  I have no doubt that there will be some Republicans who are angered or frustrated by any executive action that I may take.  Those are folks, I just have to say, who are also deeply opposed to immigration reform in any form and blocked the House from being able to pass a bipartisan bill. "
"I have said before that I actually believe that John Boehner is sincere about wanting to get immigration reform passed, which is why for a year I held off taking any action beyond what we had already done for the so-called DREAM kids, and did everything I could to give him space and room to get something done.  And what I also said at the time was, if, in fact, Congress -- if this Congress could not get something done, then I would take further executive actions in order to make the system work better, understanding that any bill that they pass will supplant the executive actions that I take."
"So I just want to reemphasize this, Major -- if, in fact, there is a great eagerness on the part of Republicans to tackle a broken immigration system, then they have every opportunity to do it.  My executive actions not only do not prevent them from passing a law that supersedes those actions, but should be a spur for them to actually try to get something done.  And I am prepared to engage them every step of the way with their ideas."
"I think we should have further broad-based debate among the American people.  As I’ve said before, I do think that the episode with the unaccompanied children changed a lot of attitudes.  I think what may also change a lot of attitudes is when the public now realizes that that was a very temporary and isolated event, and that, in fact, we have fewer illegal immigrants coming in today than we did five years ago, 10 years ago or 20 years go, but that what we also have is a system that is not serving our economy well."
"Question:  -- Republicans who say the election was a referendum, at least in part, on your intentions to use executive authority for immigration."
"President Obama:  As I said before, I don’t want to try to read the tea leaves on election results.  What I am going to try to do as President is to make sure that I’m advancing what I think is best for the country.  And here’s an opportunity where I can use my administrative authorities, executive authorities, and lawfully try to make improvements on the existing system, understanding that that’s not going to fix the entire problem, and we’re much better off if we go ahead and pass a comprehensive bill.  And I hope that the Republicans really want to get it passed.  If they do, they’re going to have a lot of cooperation from me."
"So let me just tick off -- on Keystone, there’s an independent process.  It’s moving forward.  And I’m going to let that process play out.  I’ve given some parameters in terms of how I think about it:  Ultimately, is this going to be good for the American people?  Is it going to be good for their pocketbook?  Is it going to actually create jobs?  Is it actually going to reduce gas prices that have been coming down?  And is it going to be, on net, something that doesn’t increase climate change that we’re going to have to grapple with?"
There’s a pending case before a Nebraska judge about some of the citing.  The process is moving forward.  And I’m just going to gather up the facts.
"I will note, while this debate about Canadian oil has been raging -- keep in mind this is Canadian oil, this isn’t U.S. oil -- while that debate has been raging, we’ve seen some of the biggest increases in American oil production and American natural gas production in our history.  We are closer to energy independence than we’ve ever been before -- or at least as we’ve been in decades.  We are importing less foreign oil than we produce for the first time in a very long time.  We’ve got a 100-year supply of natural gas that if we responsibly tap puts us in the strongest position when it comes to energy of any industrialized country around the world."
"When I travel to Asia or I travel to Europe, their biggest envy is the incredible homegrown U.S. energy production that is producing jobs and attracting manufacturing, because locating here means you’ve got lower energy costs. "
So our energy sector is booming.  And I’m happy to engage Republicans with additional ideas for how we can enhance that.  I should note that our clean energy production is booming as well. And so Keystone I just consider as one small aspect of a broader trend that’s really positive for the American people.
"And let’s see -- okay, medical device tax.  I’ve already answered the question.  We are going to take a look at whatever ideas -- let me take a look comprehensively at the ideas that they present.  Let’s give them time to tell me.  I’d rather hear it from them than from you."
Question:  For example --
President Obama:  Major --
Question:  I’m just telling you what they said.
"President Obama:  Conceivably, I could just cancel my meeting on Friday because I’ve heard everything from you.  I think I’d rather let Mitch McConnell --"
Question:  I just asked if it was a line you couldn’t cross.
"President Obama:  I’d rather hear from Mitch McConnell and John Boehner what ideas they’d like to pursue, and we’ll have a conversation with them on that."
"On repatriation, I said in my opening remarks that there is an opportunity for us to do a tax reform package that is good for business, good for jobs, and can potentially finance infrastructure development here in the United States. "
"Now, the devil is in the details.  So I think, conceptually, it’s something where we may have some overlap, and I’m very interested in pursuing ideas that can put folks to work right now on roads and bridges and waterways and ports, and a better air traffic control system.  If we had one, by the way, we would reduce delays by about 30 percent.  We could reduce fuel costs for airlines by about 30 percent.  And hopefully that would translate into cheaper airline tickets, which I know everybody would be interested in."
