"Good afternoon, everybody.  Have a seat."
So there’s all kind of work we can do on our infrastructure. This may be one mechanism that Republicans are comfortable in financing those kinds of efforts.  So that will be part of the discussion that I think we’re prepared for on Friday and then in the weeks to come leading into the new Congress.
"Whew.  Major works me, man. "
Jim Acosta.
"Question:  Thank you, Mr. President.  I know you don’t want to read the tea leaves, but it is a fact that your party rejected you in these midterms.  By and large, they did not want you out on the campaign trail in these key battleground states.  How do you account for that?  And your aides have said that this is the fourth quarter of your administration, but I don’t know if you saw the morning talk shows, but there were several potential candidates for 2016 who are out there already.  Is the clock ticking?  Are you running out of time?  How much time do you have left?  And what do you make of the notion that you’re now a lame duck?"
"President Obama:  Well, traditionally, after the last midterm of the two-term presidency, since I can’t run again, that’s the label that you guys apply. "
"Here’s what I tell my team -- I told them this last week and I told them this this morning -- we had this incredible privilege of being in charge of the most important organization on Earth, the U.S. government and our military, and everything that we do for good around the world."
"And there’s a lot of work to be done to make government work better, to make Americans safer, to make opportunity available to more people, for us to be able to have a positive influence in every corner of the globe -- the way we're doing right now in West Africa.  And I’m going to squeeze every last little bit of opportunity to help make this world a better place over these last two years."
"And some of that is going to be what we can do administratively, and simple things like how do we make customer service better in every agency.  Are there things we can do to streamline how our veterans access care?  Are there better ways that we can make businesses understand the programs that are available to them to promote their business or exports? "
"So there’s a whole bunch of stuff to do on that front.  And as I said before, there’s going to be opportunities to work with Democrats and Republicans on Capitol Hill to get laws done.  And if you look at the history of almost every President, those last two years, all kinds of stuff happens; in some cases, stuff that we couldn’t predict. "
"So the one thing I’m pretty confident about, Jim, is I’m going to be busy for the next two years.  And the one thing that I want the American people to be confident about is that every day I’m going to be filling up my time trying to figure out how I can make their lives better.  And if I’m doing that, at the end of my presidency, I’ll say, we played that fourth quarter well.  And we played the game well. "
"And the only difference between I guess basketball and politics is that the only score that matters is how did somebody else do, not how you did.  And that's the score I’m keeping.  Am I going to be able to look back and say, are more people working? Are there bank accounts better?  Are more kids going to college? Has housing improved?  Is the financial system more stable?  Are younger kids getting a better education?  Do we have greater energy independence?  Is the environment cleaner?  Have we done something about climate change?  Have we dealt with an ongoing terrorist threat and helped to bring about stability around the world?  And those things -- every single day I’ve got an opportunity to make a difference on those fronts, which is --"
Question:  And you're not satisfied with where you are now?
"President Obama:  Absolutely not.  I wouldn’t be satisfied as long as I’m meeting somebody who has a -- doesn’t have a job and wants one.  I’m not going to be satisfied as long as there’s a kid who writes me a letter and says, I got $60,000 worth of debt and I don’t know how to pay it back. "
And the American people aren’t satisfied.  So I want to do everything I can to deliver for them.
"Question:  And how about Democrats, the fact that they kept you out of these battleground states?  Does that kind of bug you a little bit?"
"President Obama:  Listen, as I think some of you saw when I was out on the campaign trail, I love campaigning.  I love talking to ordinary people.  I love listening to their stories.  I love shaking hands and getting hugs and just seeing the process of democracy and citizenship manifest itself during an election."
"But I’m also a practical guy.  And ultimately, every candidate out there had to make their own decisions about what they thought would be most helpful for them.  And I wanted to make sure that I’m respectful of their particular region, their particular state or congressional district, and if it was more helpful for them for me to be behind the scenes, I’m happy to do it."
Question:  You don't think it was a mistake?
"President Obama:  I don’t have -- I’ll let other people analyze that.  But what I will emphasize is that one of the nice things about being in the sixth year of your presidency is you’ve seen a lot of ups and downs and you’ve gotten more than your fair share of attention.  And I’ve had the limelight, and there have been times where the request for my appearances were endless.  There have been times where, politically, we were down -- and it all kind of evens out, which is why what’s most important I think is keeping your eye on the ball, and that is are you actually getting some good done."
"Scott Horsley, last question."
"Question:  Thank you, Mr. President.  You mentioned that where your policies actually were on the ballot they often did better than members of your party.  Does that signal some shortcoming on your part or on the party’s part in framing this election and communicating to the American people what it is that Democrats stand for?"
"President Obama:  I do think that one area where I know we’re constantly experimenting and trying to do better is just making sure that people know exactly what it is that we’re trying to accomplish and what we have accomplished in clear ways that people can -- that understand how it affects them.  And I think the minimum wage I talked about a lot on the campaign trail, but I’m not sure it penetrated well enough to make a difference. "
"Part of what I also think we’ve got to look at is that two-thirds of people who were eligible to vote just didn’t vote.  One of the things that I’m very proud of in 2008 and 2012 when I ran for office was we got people involved who hadn’t been involved before.  We got folks to vote who hadn’t voted before, particularly young people. "
"And that was part of the promise and the excitement was if you get involved, if you participate, if you embrace that sense of citizenship, then things change -- and not just in abstract ways, they change in concrete ways.  Somebody gets a job who didn’t have it before.  Somebody gets health care who didn’t have it before.  Or a student is able to go to college who couldn’t afford it before.  And sustaining that, especially in midterm elections, has proven difficult; sustaining that sense of, if you get involved and if you vote then there is going to be big change out there.  And partly I think when they look at Washington, they say, nothing is working and it’s not making a difference, and there’s just a constant slew of bad news coming over the TV screen, then you can understand how folks would get discouraged."
"But it’s my job to figure this out as best I can.  And if the way we are talking about issues isn’t working, then I’m going to try some different things.  If the ways that we’re approaching the Republicans in Congress isn’t working, I’m going to try different things -- whether it’s having a drink with Mitch McConnell or letting John Boehner beat me again at golf, or weekly press conferences -- I don’t know if that would be effective.  Whatever I think might make a difference in this, I’m going to be trying out up until my last day in office."
"But I’ll close with what I said in my opening statement.  I am really optimistic about America.  I know that runs counter to the current mood, but when you look at the facts, our economy is stronger than just about anybody’s.  Our energy production is better than just about anybody’s.  We’ve slashed our deficit by more than half.  More people have health insurance.  Our businesses have the strongest balance sheets that they’ve had in decades.  Our young people are just incredibly talented and gifted, and more of them are graduating from high school, and more of them are going on to college, and more women are getting degrees and entering into the workforce."
"And part of the reason I love campaigning is you travel around the country, folks are just good.  They're smart and they're hardworking.  And they're not always paying a lot of attention to Washington, and in some cases they’ve given up on Washington.  But their impulses are not sharply partisan, and their impulses are not ideological.  They're really practical, good, generous people. "
"And we continue to be a magnet for the best and brightest from all around the world.  We have all the best cards relative to every other country on Earth.  Our armed forces, you talk to them -- I had a chance this morning to just call some of our health service that is operating in Liberia, and the amount of hope and professionalism that they’ve brought has galvanized the entire country, and has built -- they’ve built a platform effectively for other countries suddenly to start coming in.  And we're seeing real progress in fighting the disease in a country that just a month or a month and a half ago was desperate and had no hope."
"So all that makes me optimistic.  And my job over the next couple of years is to do some practical, concrete things -- as much as possible with Congress; where it’s not possible with Congress, on my own -- to show people why we should be confident, and to give people a sense of progress and a sense of hope."
"That doesn't mean there aren’t going to be ongoing nagging problems that are stubborn and can't be solved overnight.  And probably the biggest one is the fact that despite economic growth, wages and income have still not gone up.  And that's a long-term trend that we’ve seen for 10, 20, 30 years.  And it makes people worried about not just their own situation, but whether their kids are going to be doing better than they did, which is the essence of the American Dream.  I think there are some concrete things we can do to make sure that wages and incomes do go up.  Minimum wage in those five states was a good start. "
"But I think more than anything what I want to communicate over these next two years is the promise and possibility of America.  This is just an extraordinary country.  And our democracy is messy.  And we're diverse and we're big.  And there are times where you're a politician and you're disappointed with election results.  But maybe I’m just getting older -- I don't know.  It doesn't make me mopey.  It energizes me because it means that this democracy is working.  And people in America were restless and impatient, and we want to get things done.  And even when things are going good, we want them to do better.  And that's why this is the greatest country on Earth.  That's why I’m so privileged to have a chance to be President for the next couple years."
"All right?  Thank you, everybody."
