"Hello, Galesburg!  Well, it’s good to be home in Illinois!  It is good to be back. It’s good to be back.  Thank you.  Thank you so much, everybody.  Thank you.  Everybody, have a seat, have a seat.  Well, it is good to be back. I want to, first of all, thank Knox College -- I want to thank Knox College and your president, Teresa Amott, for having me here today.  Give Teresa a big round of applause.  I want to thank your Congresswoman, Cheri Bustos, who’s here.  We've got Governor Quinn here.  I'm told we've got your Lieutenant Governor, Sheila Simon, is here.  There she is.  Attorney General Lisa Madigan is here."
"I see a bunch of my former colleagues, some folks who I haven't seen in years and I'm looking forward to saying hi to.  One in particular I've got to mention, one of my favorites from the Illinois Senate -- John Sullivan is in the house.  John was one of my earliest supporters when I was running for the U.S. Senate, and it came in really handy because he’s got, like, 10 brothers and sisters, and his wife has got 10 brothers and sisters -- so they’ve got this entire precinct just in their family.  And they all look like John -- the brothers do -- so he doesn’t have to go to every event.  He can just send one of his brothers out.  It is good to see him. Dick Durbin couldn’t make it today, but he sends his best. And we love Dick.  He’s doing a great job.  And we’ve got one of my favorite neighbors, the Senator from Missouri, Claire McCaskill, in the house, because we’re going to Missouri later this afternoon."
"And all of you are here, and it’s great to see you.  And I hope everybody is having a wonderful summer.  The weather is perfect.  Whoever was in charge of that, good job."
"So, eight years ago, I came here to deliver the commencement address for the class of 2005.  Things were a little different back then.  For example, I had no gray hair -- or a motorcade.  Didn’t even have a prompter.  In fact, there was a problem in terms of printing out the speech because the printer didn’t work here and we had to drive it in from somewhere. But it was my first big speech as your newest senator.  And on the way here I was telling Cheri and Claire about how important this area was, one of the areas that I spent the most time in outside of Chicago, and how much it represented what’s best in America and folks who were willing to work hard and do right by their families.  And I came here to talk about what a changing economy was doing to the middle class -- and what we, as a country, needed to do to give every American a chance to get ahead in the 21st century. See, I had just spent a year traveling the state and listening to your stories -- of proud Maytag workers losing their jobs when the plant moved down to Mexico.  A lot of folks here remember that.  Of teachers whose salaries weren’t keeping up with the rising cost of groceries.  Of young people who had the drive and the energy, but not the money to afford a college education."
"So these were stories of families who had worked hard, believed in the American Dream, but they felt like the odds were increasingly stacked against them.  And they were right.  Things had changed. In the period after World War II, a growing middle class was the engine of our prosperity.  Whether you owned a company, or swept its floors, or worked anywhere in between, this country offered you a basic bargain -- a sense that your hard work would be rewarded with fair wages and decent benefits, the chance to buy a home, to save for retirement, and most of all, a chance to hand down a better life for your kids. But over time, that engine began to stall -- and a lot of folks here saw it -- that bargain began to fray.  Technology made some jobs obsolete.  Global competition sent a lot of jobs overseas.  It became harder for unions to fight for the middle class.  Washington doled out bigger tax cuts to the very wealthy and smaller minimum wage increases for the working poor.  And so what happened was that the link between higher productivity and people’s wages and salaries was broken.  It used to be that, as companies did better, as profits went higher, workers also got a better deal.  And that started changing.  So the income of the top 1 percent nearly quadrupled from 1979 to 2007, but the typical family’s incomes barely budged. And towards the end of those three decades, a housing bubble, credit cards, a churning financial sector was keeping the economy artificially juiced up, so sometimes it papered over some of these long-term trends.  But by the time I took office in 2009 as your President, we all know the bubble had burst, and it cost millions of Americans their jobs, and their homes, and their savings.  And I know a lot of folks in this area were hurt pretty bad.  And the decades-long erosion that had been taking place -- the erosion of middle-class security -- was suddenly laid bare for everybody to see. Now, today, five years after the start of that Great Recession, America has fought its way back.  We fought our way back.  Together, we saved the auto industry; took on a broken health care system.   We invested in new American technologies to reverse our addiction to foreign oil.  We doubled wind and solar power.  Together, we put in place tough new rules on the big banks, and protections to crack down on the worst practices of mortgage lenders and credit card companies.  We changed a tax code too skewed in favor of the wealthiest at the expense of working families -- so we changed that, and we locked in tax cuts for 98 percent of Americans, and we asked those at the top to pay a little bit more."
"So you add it all up, and over the past 40 months, our businesses have created 7.2 million new jobs.  This year, we’re off to our strongest private sector job growth since 1999.  And because we bet on this country, suddenly foreign companies are, too.  Right now, more of Honda’s cars are made in America than anyplace else on Earth.  Airbus, the European aircraft company, they’re building new planes in Alabama.   And American companies like Ford are replacing outsourcing with insourcing -- they’re bringing jobs back home."
We sell more products made in America to the rest of the world than ever before.  We produce more natural gas than any country on Earth.  We’re about to produce more of our own oil than we buy from abroad for the first time in nearly 20 years.  The cost of health care is growing at its slowest rate in 50 years.  And our deficits are falling at the fastest rate in 60 years.
"So thanks to the grit and resilience and determination of the American people -- of folks like you -- we’ve been able to clear away the rubble from the financial crisis.  We started to lay a new foundation for stronger, more durable economic growth. And it's happening in our own personal lives as well, right?  A lot of us tightened our belts, shed debt, maybe cut up a couple of credit cards, refocused on those things that really matter.  As a country, we’ve recovered faster and gone further than most other advanced nations in the world.  With new American revolutions in energy and technology and manufacturing and health care, we're actually poised to reverse the forces that battered the middle class for so long, and start building an economy where everyone who works hard can get ahead. But -- and here's the big “but” -- I’m here to tell you today that we're not there yet.  We all know that.  We're not there yet.  We've got more work to do.  Even though our businesses are creating new jobs and have broken record profits, nearly all the income gains of the past 10 years have continued to flow to the top 1 percent.  The average CEO has gotten a raise of nearly 40 percent since 2009.  The average American earns less than he or she did in 1999.  And companies continue to hold back on hiring those who’ve been out of work for some time.  Today, more students are earning their degree, but soaring costs saddle them with unsustainable debt.  Health care costs are slowing down, but a lot of working families haven’t seen any of those savings yet.  The stock market rebound helped a lot of families get back much of what they had lost in their 401(k)s, but millions of Americans still have no idea how they’re going to be able to retire.  So in many ways, the trends that I spoke about here in 2005 -- eight years ago -- the trend of a winner-take-all economy where a few are doing better and better and better, while everybody else just treads water -- those trends have been made worse by the recession.  And that's a problem. This growing inequality not just of result, inequality of opportunity -- this growing inequality is not just morally wrong, it’s bad economics.  Because when middle-class families have less to spend, guess what, businesses have fewer consumers.  When wealth concentrates at the very top, it can inflate unstable bubbles that threaten the economy.  When the rungs on the ladder of opportunity grow farther and farther apart, it undermines the very essence of America -- that idea that if you work hard you can make it here. And that’s why reversing these trends has to be Washington’s highest priority.  It has to be Washington's highest priority.  It’s certainly my highest priority."
"Unfortunately, over the past couple of years, in particular, Washington hasn’t just ignored this problem; too often, Washington has made things worse."
"And I have to say that -- because I'm looking around the room -- I've got some friends here not just who are Democrats,  I've got some friends here who are Republicans -- and I worked with in the state legislature and they did great work.  But right now, what we’ve got in Washington, we've seen a sizable group of Republican lawmakers suggest that they wouldn’t vote to pay the very bills that Congress rang up.  And that fiasco harmed a fragile recovery in 2011 and we can't afford to repeat that.  Then, rather than reduce our deficits with a scalpel -- by cutting out programs we don’t need, fixing ones that we do need that maybe are in need of reform, making government more efficient -- instead of doing that, we've got folks who’ve insisted on leaving in place a meat cleaver called the sequester that's cost jobs.  It's harmed growth.  It's hurt our military.  It's gutted investments in education and science and medical research."
"Almost every credible economist will tell you it's been a huge drag on this recovery.  And it means that we're underinvesting in the things that this country needs to make it a magnet for good jobs. Then, over the last six months, this gridlock has gotten worse.  I didn't think that was possible.  The good news is a growing number of Republican senators are looking to join their Democratic counterparts and try to get things done in the Senate.  So that's good news.  For example, they worked together on an immigration bill that economists say will boost our economy by more than a trillion dollars, strengthen border security, make the system work.  But you've got a faction of Republicans in the House who won’t even give that bill a vote.  And that same group gutted a farm bill that America’s farmers depend on, but also America's most vulnerable children depend on. And if you ask some of these folks, some of these folks mostly in the House, about their economic agenda how it is that they'll strengthen the middle class, they’ll shift the topic to “out-of-control government spending” -- despite the fact that we've cut the deficit by nearly half as a share of the economy since I took office."
"Or they’ll talk about government assistance for the poor, despite the fact that they’ve already cut early education for vulnerable kids.  They've already cut insurance for people who’ve lost their jobs through no fault of their own.  Or they’ll bring up Obamacare -- this is tried and true -- despite the fact that our businesses have created nearly twice as many jobs in this recovery as businesses had at the same point in the last recovery when there was no Obamacare."
"Audience Member:  My daughter has insurance now! President Obama:  I appreciate that.  That’s what this is about.  That’s what this is about.  That’s what we've been fighting for.   But with this endless parade of distractions and political posturing and phony scandals, Washington has taken its eye off the ball.  And I am here to say this needs to stop.  This needs to stop.  This moment does not require short-term thinking.  It does not require having the same old stale debates.  Our focus has to be on the basic economic issues that matter most to you, the people we represent.  That’s what we have to spend our time on and our energy on and our focus on."
"And as Washington prepares to enter another budget debate, the stakes for our middle class and everybody who is fighting to get into the middle class could not be higher.  The countries that are passive in the face of a global economy, those countries will lose the competition for good jobs.  They will lose the competition for high living standards.  That’s why America has to make the investments necessary to promote long-term growth and shared prosperity -- rebuilding our manufacturing base, educating our workforce, upgrading our transportation systems, upgrading our information networks.  That’s what we need to be talking about.  That’s what Washington needs to be focused on.  And that’s why, over the next several weeks, in towns across this country, I will be engaging the American people in this debate.  I'll lay out my ideas for how we build on the cornerstones of what it means to be middle class in America, and what it takes to work your way into the middle class in America:  Job security, with good wages and durable industries.  A good education.   A home to call your own.  Affordable health care when you get sick.   A secure retirement even if you’re not rich.  Reducing poverty.  Reducing inequality.  Growing opportunity.  That’s what we need.  That’s what we need.  That’s what we need right now.  That’s what we need to be focused on."
"Now, some of these ideas I’ve talked about before.  Some of the ideas I offer will be new.  Some will require Congress.  Some I will pursue on my own.  Some ideas will benefit folks right away.  Some will take years to fully implement.  But the key is to break through the tendency in Washington to just bounce from crisis to crisis.  What we need is not a three-month plan, or even a three-year plan; we need a long-term American strategy, based on steady, persistent effort, to reverse the forces that have conspired against the middle class for decades. That has to be our project."
"Now, of course, we’ll keep pressing on other key priorities. I want to get this immigration bill done.  We still need to work on reducing gun violence.   We’ve got to continue to end the war in Afghanistan, rebalance our fight against al Qaeda.  We need to combat climate change.  We’ve got to standing up for civil rights.  We’ve got to stand up for women’s rights."
"So all those issues are important, and we’ll be fighting on every one of those issues.  But if we don’t have a growing, thriving middle class then we won’t have the resources to solve a lot of these problems.  We won’t have the resolve, the optimism, the sense of unity that we need to solve many of these other issues. Now, in this effort, I will look to work with Republicans as well as Democrats wherever I can.  And I sincerely believe that there are members of both parties who understand this moment, understand what’s at stake, and I will welcome ideas from anybody across the political spectrum.  But I will not allow gridlock, or inaction, or willful indifference to get in our way."
"That means whatever executive authority I have to help the middle class, I’ll use it.  Where I can’t act on my own and Congress isn’t cooperating, I’ll pick up the phone -- I’ll call CEOs; I’ll call philanthropists; I’ll call college presidents; I’ll call labor leaders.  I’ll call anybody who can help -- and enlist them in our efforts."
"Because the choices that we, the people, make right now will determine whether or not every American has a fighting chance in the 21st century.  And it will lay the foundation for our children’s future, our grandchildren’s future, for all Americans. So let me give you a quick preview of what I’ll be fighting for and why.  The first cornerstone of a strong, growing middle class has to be, as I said before, an economy that generates more good jobs in durable, growing industries.  That's how this area was built.  That's how America prospered.  Because anybody who was willing to work, they could go out there and they could find themselves a job, and they could build a life for themselves and their family. Now, over the past four years, for the first time since the 1990s, the number of American manufacturing jobs has actually gone up instead of down.  That's the good news.   But we can do more.  So I’m going to push new initiatives to help more manufacturers bring more jobs back to the United States.  We’re going to continue to focus on strategies to make sure our tax code rewards companies that are not shipping jobs overseas, but creating jobs right here in the United States of America."
"We want to make sure that -- we’re going to create strategies to make sure that good jobs in wind and solar and natural gas that are lowering costs and, at the same time, reducing dangerous carbon pollution happen right here in the United States."
"And something that Cheri and I were talking about on the way over here -- I’m going to be pushing to open more manufacturing innovation institutes that turn regions left behind by global competition into global centers of cutting-edge jobs.  So let’s tell the world that America is open for business.   I know there’s an old site right here in Galesburg, over on Monmouth Boulevard -- let’s put some folks to work. Tomorrow, I’ll also visit the Port of Jacksonville, Florida to offer new ideas for doing what America has always done best, which is building things.  Pat and I were talking before I came  -- backstage -- Pat Quinn -- he was talking about how I came over the Don Moffitt Bridge.  But we’ve got work to do all across the country.  We’ve got ports that aren’t ready for the new supertankers that are going to begin passing through the new Panama Canal in two years’ time.  If we don’t get that done, those tankers are going to go someplace else.  We’ve got more than 100,000 bridges that are old enough to qualify for Medicare."
"Businesses depend on our transportation systems, on our power grids, on our communications networks.  And rebuilding them creates good-paying jobs right now that can’t be outsourced."
"And by the way, this isn’t a Democratic idea.  Republicans built a lot of stuff.  This is the Land of Lincoln.  Lincoln was all about building stuff -- first Republican President.  And yet, as a share of our economy, we invest less in our infrastructure than we did two decades ago.  And that’s inefficient at a time when it’s as cheap as it’s been since the 1950s to build things.  It’s inexcusable at a time when so many of the workers who build stuff for a living are sitting at home waiting for a call.  The longer we put this off, the more expensive it will be and the less competitive we will be.  Businesses of tomorrow will not locate near old roads and outdated ports.  They’ll relocate to places with high-speed Internet, and high-tech schools, and systems that move air and auto traffic faster, and not to mention will get parents home quicker from work because we’ll be eliminating some of these traffic jams.  And we can watch all of that happen in other countries, and start falling behind, or we can choose to make it happen right here, in the United States."
"In an age when jobs know no borders, companies are also going to seek out the countries that boast the most talented citizens, and they’ll reward folks who have the skills and the talents they need -- they’ll reward those folks with good pay.  The days when the wages for a worker with a high school degree could keep pace with the earnings of somebody who got some sort of higher education -- those days are over.  Everybody here knows that.  There are a whole bunch of folks here whose dads or grandpas worked at a plant, didn’t need a high school education. You could just go there.  If you were willing to work hard, you might be able to get two jobs.  And you could support your family, have a vacation, own your home.  But technology and global competition, they’re not going away.  Those old days aren’t coming back.  So we can either throw up our hands and resign ourselves to diminishing living standards, or we can do what America has always done, which is adapt, and pull together, and fight back, and win.  That’s what we have to do."
"And that brings me to the second cornerstone of a strong middle class -- and everybody here knows it -- an education that prepares our children and our workers for the global competition that they’re going to face.  And if you think education is expensive, wait until you see how much ignorance costs in the 21st century."
"If we don’t make this investment, we’re going to put our kids, our workers, and our country at a competitive disadvantage for decades.  So we have to begin in the earliest years.  And that’s why I’m going to keep pushing to make high-quality preschool available for every 4-year-old in America.  Not just because we know it works for our kids, but because it provides a vital support system for working parents.  And I’m going to take action in the education area to spur innovation that don’t require Congress.  So, today, for example, as we speak, federal agencies are moving on my plan to connect 99 percent of America’s students to high-speed Internet over the next five years.  We’re making that happen right now.   We’ve already begun meeting with business leaders and tech entrepreneurs and innovative educators to identify the best ideas for redesigning our high schools so that they teach the skills required for a high-tech economy.   And we’re also going to keep pushing new efforts to train workers for changing jobs.  So here in Galesburg, for example, a lot of the workers that were laid off at Maytag chose to enroll in retraining programs like the one at Carl Sandburg College.  And while it didn’t pay off for everyone, a lot of the folks who were retrained found jobs that suited them even better and paid even more than the ones they had lost.  And that’s why I’ve asked Congress to start a Community College to Career initiative, so that workers can earn the skills that high-tech jobs demand without leaving their hometown.  And I’m going to challenge CEOs from some of America’s best companies to hire more Americans who’ve got what it takes to fill that job opening but have been laid off for so long that nobody is giving their résumé an honest look.  Audience Member: More talent! President Obama:  That, too. I’m also going to use the power of my office over the next few months to highlight a topic that’s straining the budgets of just about every American family -- and that’s the soaring cost of higher education.  Everybody is touched by this, including your President, who had a whole bunch of loans he had to pay off."
"Three years ago, I worked with Democrats to reform the student loan system so that taxpayer dollars stopped padding the pockets of big banks, and instead helped more kids afford college.  Then, I capped loan repayments at 10 percent of monthly incomes for responsible borrowers, so that if somebody graduated and they decided to take a teaching job, for example, that didn’t pay a lot of money, they knew that they were never going to have to pay more than 10 percent of their income and they could afford to go into a profession that they loved.  That’s in place right now.  And this week, we’re working with both parties to reverse the doubling of student loan rates that happened a few weeks ago because of congressional inaction."
"So this is all a good start -- but it isn’t enough.  Families and taxpayers can’t just keep paying more and more and more into an undisciplined system where costs just keep on going up and up and up.  We’ll never have enough loan money, we’ll never have enough grant money, to keep up with costs that are going up 5, 6, 7 percent a year.  We’ve got to get more out of what we pay for.  Now, some colleges are testing new approaches to shorten the path to a degree, or blending teaching with online learning to help students master material and earn credits in less time.  In some states, they’re testing new ways to fund college based not just on how many students enroll, but how many of them graduate, how well did they do.  So this afternoon, I’ll visit the University of Central Missouri to highlight their efforts to deliver more bang for the buck to their students.  And in the coming months, I will lay out an aggressive strategy to shake up the system, tackle rising costs, and improve value for middle-class students and their families.  It is critical that we make sure that college is affordable for every single American who’s willing to work for it."
